language_no	language	predicate_no	predicate_label_en	argument_frame_en	predicate_label_ru	argument_frame_ru	verb	X	Y	locus	valency_pattern	comms	sentence	glosses_en	back_translation_en	glosses_ru	back_translation_ru	comms_internal
76	Assyrian_Neo_Aramaic	126	despise	X (despise) Y	презирать	X (презирать) Y-а	+aynə +paləṭ	BARE	men	XY	BARE_men		+Ašur +ayn-u +plaṭ=əna mən švav-u	PN eye(F).PL-P.3M leave.PROG=3PL from neighbour(M)-P.3M	‘Ashur despises his neighbor.’	Ашур глаз(F).PL-P.3M уйти.PROG=3PL от сосед(M)-P.3M	‎Ашур презирает своего соседа.	vvi. CV (‘глаза вылезают’); есть альтернатива (‘сердце взрывается’), та же модель.
76	Assyrian_Neo_Aramaic	127	get_upset	X (get upset) with Y	огорчаться	X (огорчаться) из-за Y-а	ləbba mapyəš	BARE	men	XY	BARE_men		ləbb=ət +Ašur muppəš-lə mən brun-u	heart(M)=REL PN leave.PST-LS.3M from son(M)-P.3M	‘Ashur got upset with his son.’	сердце(M)=REL Ашур оставлять.PST-LS.3M от сын(M)-P.3M	‎Ашур огорчился из-за сына.	vab. CV. Букв. 'Сердце Х-а осталось от Y-а'. Для простоты записал это как BARE_men, хотя в конкретном случае экспериенцер кодируется как приименной посессор (сердце-REL Ашур), а не как висящий топик (Ашур сердце-его). Для простоты считаю, что это та же конструкция -- пока не доказано обратное.
76	Assyrian_Neo_Aramaic	128	get_irritated	X (get irritated) with Y	раздражаться	X (раздражаться) на Y-а	ləbba +sarəx	BARE	men	XY	BARE_men		ləbb=ət sava +srəx-lə mən navəgta	heart(M)=REL old.M be_mad.PST-LS.3M from granddaughter(F)	‘The oldman is irritated with his daughter.’	сердце(M)=REL старый.M быть_безумным.PST-LS.3M от внучка(F)	Старик огорчился из-за внучки.	vab. CV ('сердце Х-а разгневалось от У-а').
76	Assyrian_Neo_Aramaic	129	be_fond	X (be fond) of Y	симпатизировать	X (симпатизировать) Y-у	+avər gu ləbba	BARE	SBJ	X	BARE_SBJ		a naša +raba gu ləbb-i +vir=əl	DEM1.SG person(M) very in heart(M)-P.1SG enter.RES.M=3M	‘I am fond of this person.’	DEM1.SG человек(M) очень в сердце(M)-P.1SG войти.RES.M=3M	‎Я очень симпатизирую этому человеку.	vab. CV ('Y входит в сердце X-а').
76	Assyrian_Neo_Aramaic	130	be_shy	X (be shy) about Y	стесняться	X (стесняться) Y-а	naxəp	SBJ	men	Y	SBJ_men		+avvo yala bənxap=əl mən d-a kom-u	DEM3.M boy(M) be_ashamed.PROG=3M from OBL-DEM1.SG size(M)-P.3M	‘This boy is shy about his height.’	DEM3.M мальчик(M) стыдиться.PROG=3M от OBL-DEM1.SG размер(M)-P.3M	Этот парень стесняется своего роста.	vvi