language_no	language	predicate_no	predicate_label_en	argument_frame_en	predicate_label_ru	argument_frame_ru	verb	X	Y	locus	valency_pattern	comms	sentence	glosses_en	back_translation_en	glosses_ru	back_translation_ru	comms_internal	verb_original_orthography	sentence_original_orthography
65	Belarusian	123	take_offence	X (take_offence) at Y	обижаться	X (обижаться) на Y-а	pakryŭdzicca	NOM	naACC	Y	NOM_naACC		Alieś pakryŭdzi-ŭ-sia na Alien-u	PN[NOM.SG] offend(PFV)-PST.SG.M-REFL on PN-ACC.SG	‘Ales took offence at Alena.’	PN[NOM.SG] обидеть(PFV)-PST.SG.M-REFL на PN-ACC.SG	‘Алесь обиделся на Алену’.	REFL	пакрыўдзіцца	Алесь пакрыўдзі-ў-ся на Ален-у
65	Belarusian	124	upset	X (upset) Y	огорчать	X (огорчать) Y-а	zasmucić	NOM	ACC	TR	TR		Alieś zasmuci-ŭ Alien-u	PN[NOM.SG] upset(PFV)-PST.SG.M PN-ACC.SG	‘Ales greatly upset Alena.’	PN[NOM.SG] огорчить(PFV)-PST.SG.M PN-ACC.SG	‘Алесь огорчил Алену’.		засмуціць	Алесь засмуці-ў Ален-у
65	Belarusian	125	marvel	X (marvel) at Y	поражаться	X (поражаться) Y-у	urazicca	NOM	INS	Y	NOM_INS		Alieś urazi-ŭ-sia het-ym horad-am	PN[NOM.SG] amaze(PFV)-PST.SG.M-REFL this-INS.SG.M city-INS.SG	‘Ales was impressed by this town.’	PN[NOM.SG] поразить(PFV)-PST.SG.M-REFL этот-INS.SG.M город-INS.SG	‘Алесь поразился городу’.	REFL	уразіцца	Алесь уразі-ў-ся гэт-ым горад-ам
65	Belarusian	126	despise	X (despise) Y	презирать	X (презирать) Y-а	pahardžać	NOM	INS	Y	NOM_INS		Alieś pahardža-je Alien-aj	PN[NOM.SG] despise(IPFV)-PRS.3SG PN-INS.SG	‘Ales despises Alena.’	PN[NOM.SG] презирать(IPFV)-PRS.3SG PN-INS.SG	‘Алесь презирает Алену’.		пагарджаць	Алесь пагарджа-е Ален-ай
65	Belarusian	127	get_upset	X (get upset) with Y	огорчаться	X (огорчаться) из-за Y-а	zasmucicca	NOM	zzaGEN	Y	NOM_zzaGEN		Alieś zasmuci-ŭ-sia z-za sv-ajho syn-a	PN[NOM.SG] upset(PFV)-PST.SG.M-REFL from_on-behind one’s-GEN.SG.M son-GEN.SG	‘Ales got upset with his son.’	PN[NOM.SG] огорчить(PFV)-PST.SG.M-REFL с-за свой-GEN.SG.M сын-GEN.SG	‘Алесь огорчился из-за сына’.	REFL	засмуціцца	Алесь засмуці-ў-ся з-за св-айго сын-а
65	Belarusian	128	get_irritated	X (get irritated) with Y	раздражаться	X (раздражаться) на Y-а	razdražniacca	NOM	naACC	Y	NOM_naACC		Alieś razdražnia-jec-ca na sv-aju dačk-u	PN[NOM.SG] irritate(IPFV)-PRS.3SG-REFL on one’s-ACC.SG.F daughter-ACC.SG	‘Ales is getting irritated with his daughter.’	PN[NOM.SG] раздражать(IPFV)-PRS.3SG-REFL на свой-ACC.SG.F дочь-ACC.SG	‘Алесь раздражается на свою дочь’.	REFL	раздражняцца	Алесь раздражня-ец-ца на св-аю дачк-у
65	Belarusian	129	be_fond	X (be fond) of Y	симпатизировать	X (симпатизировать) Y-у	simpatyzavać	NOM	DAT	Y	NOM_DAT		Alieś simpatyz-uje Alien-je	PN[NOM.SG] be_fond(IPFV)-PRS.3SG PN-DAT.SG	‘Ales is fond of Alena.’	PN[NOM.SG] симпатизировать(IPFV)-PRS.3SG PN-DAT.SG	‘Алесь симпатизирует Алене’.	Similarly to Russian, an option with the basic verb for liking (cf. 58, падабаецца, DAT_NOM pattern) is more frequent, but this option was chosen by analogy with the stimulus	сімпатызаваць	Алесь сімпатыз-уе Ален-е
65	Belarusian	130	be_shy	X (be shy) about Y	стесняться	X (стесняться) Y-а	saromiecca	NOM	GEN	Y	NOM_GEN		Alieś saromie-jec-ca sv-ajho rost-u	PN[NOM.SG] cumber(IPFV)-PRS.3SG-REFL one’s-GEN.SG.M height-GEN.SG	‘Ales is embarrassed about his height.’	PN[NOM.SG] стесняться(IPFV)-PRS.3SG-REFL свой-GEN.SG.M рост-GEN.SG	‘Алесь стесняется своего роста’.	REFL	саромецца	Алесь сароме-ец-ца св-айго рост-у