language_no	language	predicate_no	predicate_label_en	argument_frame_en	predicate_label_ru	argument_frame_ru	verb	X	Y	locus	valency_pattern	comms	sentence	glosses_en	back_translation_en	glosses_ru	back_translation_ru	comms_internal	verb_original_orthography	sentence_original_orthography
34	Komi_Zyrian	118	be_surprised	X (be surprised) at Y	удивляться	X (удивляться) Y-у	č́ujmi̮ni̮	NOM	DAT	Y	NOM_DAT		Pet'a č́ujm-i-s koźin-li̮	PN be_surprised-PRET-3 present-DAT	‘Petja was surprised at this gift.’	PN удивляться-PRET-3 подарок-DAT	‘Петя удивился этому подарку.’		чуймыны	Петя чуйм-и-с козин-лы
34	Komi_Zyrian	119	love2	X (love) Y	любить-2	X (любить) Y (чай/яблоки)	rad'ejtni̮	NOM	ACC	TR	TR		Pet'a rad'ejt-e̮ čaj	PN like-PRS.3 tea	‘Petja loves tea.’	PN любить-PRS.3 чай	‘Петя любит чай.’	Same as 46.	радейтны 	Петя радейт-ӧ тшай
34	Komi_Zyrian	120	enjoy	X (enjoy) Y	наслаждаться	X (наслаждаться) Y-ом	č́e̮smaśni̮	NOM	INS	Y	NOM_INS		Pet'a č́e̮smaś-i-s pe̮ś čaj-e̮n	PN enjoy-PRET-3 hot tea-INS	‘Petja enjoyed hot tea.’	PN наслаждаться-PRET-3 горячий чай-INS	‘Петя наслаждается горячим чаем.’		чӧсмасьны	Петя чӧсмас-и-с пӧсь тшай-ӧн
34	Komi_Zyrian	121	want	X (want) Y	хотеть	X (хотеть) Y-а	ke̮sji̮ni̮	NOM	ACC	TR	TR		Pet'a ke̮sj-e̮ vi̮l' mobil'ńik	PN want-PRS.3 new mobile_phone	‘Petja wants a new mobile phone.’	PN хотеть-PRS.3 новый мобильник	‘Петя хочет новый мобильник.’		кӧсйыны	Петя кӧсй-ӧ выль мобильник
34	Komi_Zyrian	122	have_a_grudge	X (have a grudge) against Y	сердиться	X (сердиться) на Y-а	ske̮ravni̮	NOM	vile	Y	NOM_vile		Pet'a ske̮ral-e̮ Maša vi̮l-e̮	PN be_angry-PRS.3 PN top-ILL	‘Petja is angry with Masha.’	PN сердиться-PRS.3 PN верх-ILL	‘Петя сердится на Машу.’	Same as 117.	скӧравны 	Петя скӧрал-ӧ Маша выл-ӧ
34	Komi_Zyrian	123	take_offence	X (take_offence) at Y	обижаться	X (обижаться) на Y-а	l'okavni̮	NOM	vile	Y	NOM_vile		Pet'a l'okal-e̮ Maša vi̮l-e̮	PN take_offence-PRS.3 PN top-ILL	‘Petja is upset by Masha.’	PN раздражаться-PRS.3 PN верх-ILL	‘Петя обиделся на Машу.’	Alternative are verbs “лёкавны” ‘be angry’ and “дöзмыны” ‘be irritated’, both used in the NOM_vylo pattern.	лёкавны 	Петя скӧрм-и-с Маша выл-ӧ
34	Komi_Zyrian	124	upset	X (upset) Y	огорчать	X (огорчать) Y-а	majše̮dli̮ni̮	NOM	ACC	TR	TR		Pet'a jona majše̮dl-i-s Maša-e̮s	PN strongly upset-PRET-3 PN-ACC	‘Petja greatly upset Masha.’	PN сильно внушать_беспокойство-PRET-3 PN-ACC	‘Петя очень огорчил Машу’		майшӧдлыны	Петя ёна майшӧдл-i-с Маша-ӧс
34	Komi_Zyrian	125	marvel	X (marvel) at Y	поражаться	X (поражаться) Y-у	šenźi̮ni̮	NOM	INS	Y	NOM_INS		Pet'a šenź-i-s taje̮ kar-nas	PN be_stunned-PRET-3 this town-INS.P.3SG	‘Petja was stunned  by this town.’	PN поражаться-PRET-3 этот город-INS.P.3SG	‘Петя поразился этому городу.’	This verb can also be used in the NOM_DAT pattern: “Петя шенз-и-с тайӧ кар-ыс-лы” [Петя поразиться-PRET-3 этот город-P.3SG-DAT] ‘Петя поразился этому городу.’	шензьыны	Петя шенз-и-с тайӧ кар-нас
34	Komi_Zyrian	126	despise	X (despise) Y	презирать	X (презирать) Y-а	muste̮mtni̮	*	*	*		Not included in the database because this translation is semantically inaccurate.	Pet'a muste̮mt-e̮ Maša-e̮s	PN hate-PRS.3 PN-ACC	‘Petja hates  Masha.’	PN ненавидеть-PRS.3 PN-ACC	‘Петя ненавидит Машу.’		мустӧмтны 	Петя мустӧмт-ӧ Маша-ӧс
34	Komi_Zyrian	127	get_upset	X (get upset) with Y	огорчаться	X (огорчаться) из-за Y-а	šoge̮ uśni̮	NOM	ponda	Y	NOM_ponda		Pet'a šog-e̮ uś-i-s pi-i̮s ponda	PN grief-ILL fall-PRET-3 son-P.3SG because_of	‘Petja got upset with his son.’	PN горе-ILL падать-PRET-3 сын-P.3SG из-за	‘Петя огорчился из-за своего сына.’	CV. Lit. 'to fall into grief'.	шогӧ усьны	Петя шог-ӧ ус-и-с пи-ыс понда
34	Komi_Zyrian	128	get_irritated	X (get irritated) with Y	раздражаться	X (раздражаться) на Y-а	de̮zmi̮ni̮	NOM	vile	Y	NOM_vile		Pet'a de̮zm-e̮ ni̮v vi̮l-as	PN get_irritated-PRS.3 daughter top-ILL.P.3SG	‘Petja is getting irritated with his daughter.’	PN раздражаться-PRS.3 дочь верх-ILL.P.3SG	‘Петя раздражается на свою дочь.’	The postposition is an inflected form, hence looks different compared to other examples.	дӧзмыны	Петя дӧзм-ӧ ныв выл-ас
34	Komi_Zyrian	129	be_fond	X (be fond) of Y	симпатизировать	X (симпатизировать) Y-у	voni̮ śe̮le̮m vi̮le̮	DAT	NOM	X	DAT_NOM		Pet'a-li̮ vo-e̮ śe̮le̮m vi̮l-as Maša	PN-DAT come-PRS.3 heart top-ILL.P.3SG PN	‘Petja is fond of Masha.’	PN-DAT прийти-PRS.3 сердце верх-ILL.P.3SG PN	‘Петя симпатизирует Маше.’	CV.	воны сьӧлӧм вылӧ	Петя-лы во-ӧ сьӧлӧм выл-ас Маша
34	Komi_Zyrian	130	be_shy	X (be shy) about Y	стесняться	X (стесняться) Y-а	jandi̮śni̮	NOM	ELA	Y	NOM_ELA		Pet'a jandi̮ś-e̮ as-las tuša-i̮ś	PN be_shy-PRS.3 self-GEN.P.3SG height-ELA	‘Petja is embarrassed about his height.’	PN стесняться-PRS.3 сам-GEN.P.3SG рост-ELA	‘Петя стыдится своего роста’	Alternative is a non-verbal predicate “абу лöсьыд” ‘uncomfortable’ used in the DAT_ponda pattern: “Петя-лы абу лӧсьыд ас туша понда” [Петя-DAT NEG удобный сам.3SG рост из-за] ‘Петя стесняется своего роста.’	яндысьны	Петя яндысь-ӧ ас-лас туша-ысь