language_no	language	predicate_no	predicate_label_en	argument_frame_en	predicate_label_ru	argument_frame_ru	verb	X	Y	locus	valency_pattern	comms	sentence	glosses_en	back_translation_en	glosses_ru	back_translation_ru	comms_internal	verb_original_orthography	sentence_original_orthography
144	Lak_Quba	124	upset	X (upset) Y	огорчать	X (огорчать) Y-а		GEN	NOM	TR	TR		Maħammad-u-l qin-nu Aˁšura qːuma laga-n b-und-i	PN-OBL-GEN good-ADVBZ PN sad go.IPFV-INF 3-do.AOR-3P	‘Mohammad greatly upset Ashura.’		‘Магомед очень огорчил Ашуру.’	CV. NB: local han instead of lagan, but unclear about this context		Махlаммадул хъинну Аьшура къума лаган бунди.
144	Lak_Quba	125	marvel	X (marvel) at Y	поражаться	X (поражаться) Y-у		NOM	SUP	Y	NOM_SUP		Maħammad maħatːal x-und-i wa šahru-li-j	PN be.amazed become-AOR-3P this town-OBL-SUP	‘Mohammad was impressed by this town.’		‘Магомед поразился этому городу.’	CV		Махlаммад махlаттал хьунди ва шагьрулий.
144	Lak_Quba	126	despise	X (despise) Y	презирать	X (презирать) Y-а		DAT	NOM	X	DAT_NOM		Maħammad-u-n kːa<w>kː-un qːa-čːa-r Rasul	PN-OBL-DAT <1>see-CVB.PFV NEG-want-PRS.3P PN	‘Mohammad despises Rasul.’		‘Магомед презирает Расула.’	CV		Махlаммадун ккавккун къаччар Расул.
144	Lak_Quba	127	get_upset	X (get upset) with Y	огорчаться	X (огорчаться) из-за Y-а		NOM	SUPEL	Y	NOM_SUPEL		Maħammad qːuma la<w>g-und-i cala ars-na-j-a	PN sad <1>become-AOR-3P self.OBL.1-GEN-1.PTCL son-OBL-SUP-EL	‘Mohammad got upset with his son.’		‘Магомед огорчился из-за своего сына.’	CV		Махlаммад къума лавгунди цала арсная.
144	Lak_Quba	128	get_irritated	X (get irritated) with Y	раздражаться	X (раздражаться) на Y-а		NOM	SUPLAT	Y	NOM_SUPLAT		b-urig-i, c'unil=gu Maħammad sːi b-iz-la-j ur ca-l-ba duš-ni-j-n	HPL-look-IMP again=ADD PN anger 3-stand.up-IPFV-CVB.IPFV 1.be.PRS.3P self.OBL.1-GEN-3.PTCL daughter-OBL-SUP-LAT	‘Look, Mohammad is getting irritated with his daughter again.’		‘Смотри, Магомед снова раздражается на свою дочь.’	Cf. comments for 111, 116, 117 (122 is basically identical). Note that the native spelling is different here (“сси” is treated as a separate word). Misha’s older comment: “проверить на сыне”.		Буриги, ц!унилгу Махlаммад сси бизлай ур цалба душнийн.
144	Lak_Quba	129	be_fond	X (be fond) of Y	симпатизировать	X (симпатизировать) Y-у		*	*	*		Not included in the database because X is (arguably) expressed as an NP-internal modifier.	Maħammad-u-l dak'-ni-l la<w>s-un b-ur Aˁšura	PN-OBL-GEN heart-OBL-GEN <3>take-CVB.PFV 3-be.PRS.3P PN	‘Mohammad is fond of Ashura.’		‘Магомед симпатизирует Ашуре.’	The literal back translation would be ‘Mohammad’s heart takes Ashura’.		Махlаммадул дак!нил лавсун бур Аьшура.
144	Lak_Quba	130	be_shy	X (be shy) about Y	стесняться	X (стесняться) Y-а		NOM	SUPEL	Y	NOM_SUPEL		Maħammad-u-n nač qan-aj d-ur ca-l-da qʼarqʼal-tːu-l laq-širu-j-a	PN-OBL-DAT shame(4) become.IPFV-CVB.IPFV 4-be.PRS.3P self.OBL.1-4.PTCL body-PL-GEN be.high-NMLZ-SUP-EL	‘Mohammad is embarrassed about his height.’		‘Магомед стесняется своего роста.’	CV		Махlаммадун нач хъанай дур цалда кьаркьалттул лахъшируя.