language_no	language	predicate_no	predicate_label_en	argument_frame_en	predicate_label_ru	argument_frame_ru	verb	X	Y	locus	valency_pattern	comms	sentence	glosses_en	back_translation_en	glosses_ru	back_translation_ru	comms_internal
129	Lezgian_Yargun	116	envy	X (envy) Y	–∑–∞–≤–∏–¥–æ–≤–∞—Ç—å	X (–∑–∞–≤–∏–¥–æ–≤–∞—Ç—å) Y-—É	ppaxil + COP	NOM	SUP	Y	NOM_SUP	Non-verbal predicate.	Sahib Eldar-a-l ppaxil ya	PN PN-OBL-SUP envious COP	‚Äé‚Äé‚Äé‚ÄòSahib envies Eldar.‚Äô			ya = copule d‚Äôidentification ; pas de masdar ; mais on peut utiliser le verbe ‚Äòdevenir‚Äô jen √Ý la place
129	Lezgian_Yargun	117	be_angry	X (be angry) with Y	–∑–ª–∏—Ç—å—Å—è	X (–∑–ª–∏—Ç—å—Å—è) –Ω–∞ Y-–∞	qhel qven	DAT	SUB/POSTEL	XY	DAT_SUB/POSTEL		Sahib-a-z Eldar-a-kaa qhel qve-zva	PN-OBL-DAT PN-OBL-SUB/POSTEL anger come.IPFV-PRS	‚Äé‚Äé‚Äé‚ÄòSahib is angry with Eldar.‚Äô			CV. Here, the meaning is like ‚Äúla col√®re est exprim√©e, elle est souvent provisoire, c'est plus 's'√©nerver'‚Äù.
129	Lezgian_Yargun	118	be_surprised	X (be surprised) at Y	—É–¥–∏–≤–ª—è—Ç—å—Å—è	X (—É–¥–∏–≤–ª—è—Ç—å—Å—è) Y-—É	mehttel jen	NOM	SUP	Y	NOM_SUP		Sahib in ppadarkka-da-l mehttel xha-na	PN this gift-OBL-SUP surprised become.PFV-AOR	‚Äé‚Äé‚Äé‚ÄòSahib was surprised at this gift.‚Äô			CV. Same as 125.
129	Lezgian_Yargun	119	love2	X (love) Y	–ª—é–±–∏—Ç—å-2	X (–ª—é–±–∏—Ç—å) Y (—á–∞–π/—è–±–ª–æ–∫–∏)	kkan jen	DAT	NOM	X	DAT_NOM		Sahib-a-z √ßay ppara kkan-da	PN-OBL-DAT tea much want-EVT	‚Äé‚Äé‚Äé‚ÄòSahib loves tea.‚Äô			Same as 46, 113, 121.
129	Lezgian_Yargun	120	enjoy	X (enjoy) Y	–Ω–∞—Å–ª–∞–∂–¥–∞—Ç—å—Å—è	X (–Ω–∞—Å–ª–∞–∂–¥–∞—Ç—å—Å—è) Y-–æ–º	lezzet qa√ßun	ERG	SUB/POSTEL	Y	ERG_SUB/POSTEL		Sahib-a qaynar √ßay-ini-kaa lezzet qa√ßu-zva	PN-ERG hot tea-OBL-SUB/POSTEL pleasure take-PRS	‚Äé‚Äé‚Äé‚ÄòSahib enjoys hot tea.‚Äô			CV. The last word can also be ‚Äúxukkud-zva‚Äù [take_out-PRS] with the same valency pattern.
129	Lezgian_Yargun	121	want	X (want) Y	—Ö–æ—Ç–µ—Ç—å	X (—Ö–æ—Ç–µ—Ç—å) Y-–∞	kkan jen	DAT	NOM	X	DAT_NOM		Sahib-a-z cÀàii ttilifun kkan-zva	PN-OBL-DAT new telephone want-PRS	‚Äé‚Äé‚Äé‚ÄòSahib wants a new mobile phone.‚Äô			Same as 46, 113, 119.
129	Lezgian_Yargun	122	have_a_grudge	X (have a grudge) against Y	—Å–µ—Ä–¥–∏—Ç—å—Å—è	X (—Å–µ—Ä–¥–∏—Ç—å—Å—è) –Ω–∞ Y-–∞	qhelin	ERG	SUB/POSTEL	Y	ERG_SUB/POSTEL		Sahib-a Eldar-a-kaa qhel-nva	PN-ERG PN-OBL-SUB/POSTEL sulk-PRF	‚ÄòSahib holds a grudge against Eldar.‚Äô			Here, the meaning is ‚Äúil ne lui adresse plus la parole‚Äù. Alternatives are ‚ÄúSahib-a-z Eldar-a-kaa qhel ava‚Äù [PN-OBL-DAT PN-OBL-SUB/POSTEL anger be.in], where the meaning is that of ‚Äú√©tat o√π la col√®re dure‚Äù and ‚ÄúSahib Eldar-a-kaa tÀàakÀàu-nva‚Äù [PN PN-OBL-SUB/POSTEL swell.PFV/MAS PRF] where the meaning is ‚Äúil est bless√©, l√Ý, c'est plus le c√¥t√© coeur qui vient en jeu, les sentiments, alors que dans les formules avec 'qhel', ce sont plus des arguments qui sont pris en compte)‚Äù. See also roughly the same meaning in 123 with ‚Äúbeykef xhanva‚Äù.
129	Lezgian_Yargun	123	take_offence	X (take_offence) at Y	–æ–±–∏–∂–∞—Ç—å—Å—è	X (–æ–±–∏–∂–∞—Ç—å—Å—è) –Ω–∞ Y-–∞	beykef jen	NOM	SUB/POSTEL	Y	NOM_SUB/POSTEL		Sahib Eldar-a-kaa beykef xha-nva	PN PN-OBL-SUB/POSTEL offended become.PFV-PRF	‚Äé‚Äé‚Äé‚ÄòSahib took offence at Eldar.‚Äô			CV. Alternative is ‚ÄúSahib Eldar-a-kaa tÀàakÀàu-nva‚Äù [PN PN-OBL-SUB/POSTEL swell.PFV/MAS-PRF] with the same valency pattern. See the discussion in 122.
129	Lezgian_Yargun	124	upset	X (upset) Y	–æ–≥–æ—Ä—á–∞—Ç—å	X (–æ–≥–æ—Ä—á–∞—Ç—å) Y-–∞	ppa»ômanrin	ERG	NOM	TR	TR		Sahib-a Eldar ppara ppa»ôman-ar-na	PN-ERG PN much sad-CAUS-AOR	‚Äé‚Äé‚Äé‚ÄòSahib greatly upset Eldar.‚Äô			CAUS
129	Lezgian_Yargun	125	marvel	X (marvel) at Y	–ø–æ—Ä–∞–∂–∞—Ç—å—Å—è	X (–ø–æ—Ä–∞–∂–∞—Ç—å—Å—è) Y-—É	mehttel jen	NOM	SUP	Y	NOM_SUP		Sahib in »ôeher-da-l mehttel xha-na	PN this town-OBL-SUP surprised become.PFV-AOR	‚Äé‚Äé‚Äé‚ÄòSahib was impressed by this town.‚Äô			CV. Same as 118.
129	Lezgian_Yargun	126	despise	X (despise) Y	–ø—Ä–µ–∑–∏—Ä–∞—Ç—å	X (–ø—Ä–µ–∑–∏—Ä–∞—Ç—å) Y-–∞	nehin	ERG	NOM	TR	TR		Sahib-a Eldar neh-nva	PN-ERG PN ignore-PRF	‚Äé‚Äé‚Äé‚ÄòSahib despises Eldar.‚Äô			Alternatives are ‚ÄúSahib-a Eldar xiseb-a qa-za-»ô‚Äù [PN-ERG PN count-IN take.IPFV-PRS-NEG] and ‚ÄúSahib-a Eldar saymi»ô-za-»ô‚Äù [PN-ERG PN count_VN-PRS NEG] with the same valency pattern.‚Äé
129	Lezgian_Yargun	127	get_upset	X (get upset) with Y	–æ–≥–æ—Ä—á–∞—Ç—å—Å—è	X (–æ–≥–æ—Ä—á–∞—Ç—å—Å—è) –∏–∑-–∑–∞ Y-–∞	hayifar jen	DAT	DATgure	XY	DAT_DATgure		Sahib-a-z vi√ß-i-n gada-di-z g√ºre hayif-ar xha-na	PN-OBL-DAT self-OBL-GEN son-OBL-DAT because_of regret-PL become.PFV-AOR	‚Äé‚Äé‚Äé‚ÄòSahib got upset with his son.‚Äô			CV. The word for "regret" happens to be in the plural.
129	Lezgian_Yargun	128	get_irritated	X (get irritated) with Y	—Ä–∞–∑–¥—Ä–∞–∂–∞—Ç—å—Å—è	X (—Ä–∞–∑–¥—Ä–∞–∂–∞—Ç—å—Å—è) –Ω–∞ Y-–∞	giji jen	NOM	SUB/POSTEL	Y	NOM_SUB/POSTEL		Sahib vi√ß-i-n ru»ô-a-kaa giji je-zva	PN self-OBL-GEN daughter-OBL-SUB/POSTEL irritated become.IPFV-PRS	‚Äé‚Äé‚Äé‚ÄòSahib is getting irritated with his daughter.‚Äô			CV. Ayten: ‚ÄúMais 'giji' a un sens plus fort, j'ai l'impression.‚Äù
129	Lezgian_Yargun	129	be_fond	X (be fond) of Y	—Å–∏–º–ø–∞—Ç–∏–∑–∏—Ä–æ–≤–∞—Ç—å	X (—Å–∏–º–ø–∞—Ç–∏–∑–∏—Ä–æ–≤–∞—Ç—å) Y-—É	xu≈ü qven	DAT	SUB/POSTEL	XY	DAT_SUB/POSTEL		Sahib-a-z Lale-d-kaa xu»ô qve-zva	PN-OBL-DAT PN-OBL-SUB/POSTEL pleasant come.IPFV-PRS	‚Äé‚Äé‚Äé‚ÄòSahib is fond of Lale.‚Äô			CV. Same as 58.
129	Lezgian_Yargun	130	be_shy	X (be shy) about Y	—Å—Ç–µ—Å–Ω—è—Ç—å—Å—è	X (—Å—Ç–µ—Å–Ω—è—Ç—å—Å—è) Y-–∞	re«ß√º jen	DAT	SUB/POSTEL	XY	DAT_SUB/POSTEL		Samire-di-z vi√ß-i-n boy-di-kaa re«ß√º-zva	PN-OBL-DAT self-OBL-GEN height-OBL-SUB/POSTEL be_shy-PRS	‚Äé‚Äé‚Äé‚ÄòSamira is embarrassed about her height.‚Äô			