language_no	language	predicate_no	predicate_label_en	argument_frame_en	predicate_label_ru	argument_frame_ru	verb	X	Y	locus	valency_pattern	comms	sentence	glosses_en	back_translation_en	glosses_ru	back_translation_ru	comms_internal
129	Lezgian_Yargun	65	fall_behind	X (fall behind) Y	–æ—Ç—Å—Ç–∞—Ç—å	X (–æ—Ç—Å—Ç–∞–≤–∞—Ç—å) –æ—Ç Y-–∞	cc√º«ßvena amuqÀàin	NOM	SUPEL	Y	NOM_SUPEL		Sahib Eldar-a-laa cc√º«ßvena amuqÀà-na	PN PN-OBL-SUPEL behind.IN remain-AOR	‚Äé‚Äé‚Äé‚ÄòSahib fell behind Eldar.‚Äô			CV, ‚Äúcc√º«ßvena‚Äù functions as an adverbial expression here and part of the predicate expression. It is possible to insert additional material between ‚ÄúEldar-a-laa‚Äù and ‚Äúcc√º«ßvena‚Äù, e.g. ‚Äúppara‚Äù ‚Äòbeaucoup‚Äô, ‚Äòtr√®s‚Äô¬Ý: Sahib Eldar-a-laa ppara cc√º«ßvena amuqÀà-na. Besides, it is possible to just drop the second argument and the sentence remains grammatical. Although Ayten adds that ‚Äúmoi, je le sens comme une anaphore z√©ro¬Ý: on est toujours en retard par rapport √Ý qqn ou par rapport √Ý soi-m√™me.‚Äù
129	Lezgian_Yargun	66	plough	X (plough) Y	–ø–∞—Ö–∞—Ç—å	X (–ø–∞—Ö–∞—Ç—å) Y	ccan ccan	ERG	IN	Y	ERG_IN		Sahib-a nikka ccan cca-zva	PN-ERG field.IN plowing plough.IPFV/PFV-PRS	‚Äé‚Äé‚Äé‚ÄòSahib is ploughing the field.‚Äô			CV. "nikka" happens to be unsegmentable (cf. the nominative "nik" with aspirated "k"), but other nouns would be used in a regular Inessive form here. The reason for using the IPFV/PFV gloss is that the verb‚Äôs stems are distributed as cca- plough.PFV/IPFV- vs. ccu- plough.MAS-.
129	Lezgian_Yargun	67	smell	X (smell) like / of Y	–ø–∞—Ö–Ω—É—Ç—å	X (–ø–∞—Ö–Ω—É—Ç—å) Y-–æ–º	ni qven	*	*	*		Not included in the database because Y is expressed as an NP-internal modifier.	zu «ßil-er-i-kaa benzin-di-n ni qve-zva	1SG.GEN hand-PL-OBL-SUB/POSTEL gasoline-OBL-GEN smell come.IPFV-PRS	‚Äé‚Äé‚Äé‚ÄòMy hands smell of gasoline.‚Äô			CV. Ayten has provided extensive evidence for treating the genitive noun as an NP-internal component: it is not possible to insert here anything except for attibutes like ‚Äúbad‚Äù (benzin-di-n pis ni ‚Äòune mauvaise odeur d‚Äôessence‚Äô). For purposes of focusing, Lezgian employs the preverbal position and ‚ÄúLe g√©nitif est normalement focalis√© avec sa t√™te‚Äù. The same conclusion emerges from the pseudo-cleft constructions.
129	Lezgian_Yargun	68	cross	X (cross) Y	–ø–µ—Ä–µ—Å–µ—á—å	X (–ø–µ—Ä–µ—Å–µ–∫–∞—Ç—å) Y (—É–ª–∏—Ü—É) 	alatin	NOM	SUPEL	Y	NOM_SUPEL		Sahib reqe-laa alat-na	PN way.OBL-SUPEL pass-AOR	‚Äé‚Äé‚Äé‚ÄòSahib crossed the road.‚Äô			Alternative is the structure ‚ÄúSahib reqi-n an ppatta-z aqat-na‚Äù [PN way.OBL-GEN that side.OBL-DAT come_out-AOR]. Ayten maintains that the two structures are equally frequent. I chose this version based on the simplicity criterion: this one is headed by a simplex verb. AB: ‚ÄúAlatin correspond √Ý ‚Äòtraverser‚Äô et an ppattaz aqatin √Ý ‚Äòaller de l‚Äôautre c√¥t√©‚Äô.‚Äù
129	Lezgian_Yargun	69	sing	X (sing) Y	–ø–µ—Ç—å	X (–ø–µ—Ç—å) Y	luhun	ERG	NOM	TR	TR		Sahib-a sa ayar sa ma ïni laha-na	PN-ERG one beautiful one song say.PFV-AOR	‚Äé‚Äé‚Äé‚ÄòSahib sang a beautiful song.‚Äô			Same verb as in 17, 51, different pattern. Repetition of "one" is correct (although not obligatory).
129	Lezgian_Yargun	70	write	X (write) Y	–ø–∏—Å–∞—Ç—å	X (–ø–∏—Å–∞—Ç—å) Y	kxhin	ERG	NOM	TR	TR		Sahib-a mixhttub kxha-na	PN-ERG letter write.PFV-AOR	‚Äé‚Äé‚Äé‚ÄòSahib wrote a letter.‚Äô			
129	Lezgian_Yargun	71	drink	X (drink) Y	–ø–∏—Ç—å	X (–ø–∏—Ç—å) Y	qhvan	ERG	NOM	TR	TR		Sahib-a nek qhva-na	PN-ERG milk drink.PFV/IPFV-AOR	‚Äé‚Äé‚Äé‚ÄòSahib drank the milk.‚Äô			The reason for using the PFV/IPFV label is that the stems of this verb are distributed as qhva- drink.PFV/IPFV- vs. qhu- drink.MAS-.
129	Lezgian_Yargun	72	melt	X (melt) Y	–ø–ª–∞–≤–∏—Ç—å	X (–ø–ª–∞–≤–∏—Ç—å) Y	cÀàurcÀàurrin	ERG	NOM	TR	TR		Sahib-a qÀàurqÀàu»ôum-di-n sa kÀàus cÀàurcÀàu-r-ar-na	PN-ERG lead-OBL-GEN one piece melt.PFV/OP-CAUS-CAUS-AOR	‚Äé‚Äé‚Äé‚ÄòSahib melted a piece of lead.‚Äô			CAUS. The reason for using the PFV/MAS label is that the stems of this verb are distributed as
129	Lezgian_Yargun	73	match	X (match) Y	–ø–æ–¥—Ö–æ–¥–∏—Ç—å	X (–ø–æ–¥—Ö–æ–¥–∏—Ç—å) –∫ Y-—É (–ø–æ—è—Å –∫ –ø–ª–∞—Ç—å—é)	qan	ERG	SUB/POSTgalaz	Y	ERG_SUB/POSTgalaz		in √ßÀà√ºl-√ºni zu bulu»ôa-d galaz qa-zva	this belt-ERG 1SG.GEN dress-OBL(SUB/POST) with take.IPFV-PRS	‚Äé‚Äé‚Äé‚ÄòThis belt goes well with my dress.‚Äô			Same verb as in 18, 43, 75, different pattern. Alternative is ‚Äúin √ßÀà√ºl zu bulu»ôa-di-z t√ºkk√º-zva‚Äù [this belt 1SG.GEN dress-OBL-DAT suit.IPFV/MAS-PRS] with the NOM_DAT pattern. Ayten mentioned that there is no difference between the two options. The only reason I used when choosing this option was that it paralleled the option provided by Ramazan Mamedshaxov.
129	Lezgian_Yargun	74	leave	X (leave) Y	–ø–æ–∫–∏–¥–∞—Ç—å	X (–ø–æ–∫–∏–¥–∞—Ç—å) Y(-–∞)	aqatna fin	NOM	INEL	Y	NOM_INEL		Sahib vi√ß-i-n xii »ôeher-d-aa aqat-na fe-na	PN self-OBL-GEN native town-OBL-INEL come_out-SEQ go.PFV-AOR	‚Äé‚Äé‚Äé‚ÄòSahib left his native city.‚Äô			CV
129	Lezgian_Yargun	75	cover	X (cover) Y	–ø–æ–∫—Ä—ã–≤–∞—Ç—å	X (–ø–æ–∫—Ä—ã–≤–∞—Ç—å) Y	qan	ERG	NOM	TR	TR		xali√ßa-di √ß√ßil viri qu-nva	carpet-ERG earth all take.PFV/OP-PRF	‚Äé‚Äé‚Äé‚Äé‚Äé'The carpet covers the whole floor.‚Äô			Same as 18, 43, same verb as in 73. The reason for using the PFV/MAS label is that the stems of this verb are distributed as qu- take.PFV/MAS- vs. qa- take.IPFV-.
129	Lezgian_Yargun	76	remember	X (remember) Y	–ø–æ–º–Ω–∏—Ç—å	X (–ø–æ–º–Ω–∏—Ç—å) Y-–∞	rik‚Äôal alama (alama = locative copula)	GEN	NOM	X	GEN_NOM	Non-verbal predicate. The NP in the genitive displays some properties of a clause-level dependent.	vi√ß √ßÀàexi xhii kÀàval Sahib-a-n rikÀà-a-l qhsan ala-ma	self big become.AOP house PN-OBL-GEN heart-OBL-SUP well be.on-CONT	‚Äé‚Äé‚Äé‚ÄòSahib vividly remembers the house where he grew up.‚Äô			It is possible to place ‚ÄúSahiban‚Äù at the beginning of this sentence: Sahib-a-n vi√ß √ßÀàexi xhii kÀàval qhsan rikÀà-a-l ala-ma. "alama" est une copule locative, il n‚Äôy a pas de masdar ; mais on peut utiliser le verbe ‚Äòrester sur‚Äô alumuq‚Äôin.
129	Lezgian_Yargun	77	help	X (help) Y	–ø–æ–º–æ—á—å	X (–ø–æ–º–æ–≥–∞—Ç—å) Y-—É	k√ºmekin	ERG	DAT	Y	ERG_DAT		Sahib-a Eldar-a-z k√ºmek-na	PN-ERG PN-OBL-DAT help-AOR	‚Äé‚Äé‚Äé‚ÄòSahib helped Eldar.‚Äô			
129	Lezgian_Yargun	78	understand	X (understand) Y	–ø–æ–Ω–∏–º–∞—Ç—å	X (–ø–æ–Ω–∏–º–∞—Ç—å) Y	 ïavurda aqÀàan	NOM	GEN	Y	NOM_GEN	The NP in the genitive displays some properties of a clause-level dependent.	Sahib fransuz √ßÀàal-a-n  ïavur-d-a aqÀàa-zva	PN French language-OBL-GEN understanding-OBL-IN bump.IPFV-PRS	‚Äé‚Äé‚Äé‚ÄòSahib understands French.‚Äô			CV. It is possible to insert material between the genitival NP and ‚Äúunderstanding‚Äù or else to move the genitival noun around the sentence, cf. ‚ÄúIna fransuz √ßÀàal-a-n tek sa Sahib  ïavur-d-a aqÀàa-zva‚Äù [here French language-OBL-GEN only one PN understanding-OBL-IN bump.IPFV-PRS] ‚ÄòIci, il n‚Äôy a que Sahib qui comprend le fran√ßais.‚Äô.
129	Lezgian_Yargun	79	hit#target#	X (hit) Y	–ø–æ–ø–∞—Å—Ç—å	X (–ø–æ–ø–∞–¥–∞—Ç—å) –≤ Y (–º–æ–ª–Ω–∏—è –≤ –¥–æ–º)	avatin	NOM	SUP	Y	NOM_SUP		cÀàaalapan kÀàval-a-l avat-na	lightning house-OBL-SUP fall-AOR	‚Äé‚Äé‚Äé‚ÄòLightning struck the house.‚Äô			Same verb as 86, different pattern. Alternative is ‚ÄúcÀàaalapan-di kÀàval ya ïa-na‚Äù [lightning-ERG house hit.PFV/IPFV-AOR] with the transitive pattern. Ayten did not report any differnce between the two structures in terms of naturalness. The reason I chose this one is because it is intransitive, and also because Ayten mentioned that the other one would be prefereble if the second argument were human (this said, she did not calim that this one is actually preferred with ‚Äòhouse‚Äô as the second argument).
129	Lezgian_Yargun	80	cut_oneself	X (cut oneself) with Y	–ø–æ—Ä–µ–∑–∞—Ç—å—Å—è	X (—Ä–µ–∑–∞—Ç—å—Å—è) Y-–æ–º	at‚Äôun	*	*	*		Not included in the database because X is expressed as an NP-internal modifier.	Sahib-a-n √ß√ßin lezvi-di atÀàa-na	PN-OBL-GEN face blade-ERG cut.PFV-AOR	‚Äé‚Äé‚Äé‚ÄòThe razor cut Sahib‚Äôs face.‚Äô			
129	Lezgian_Yargun	81	get_stuck	X (get stuck) to Y	–ø—Ä–∏–ª–∏–ø–∞—Ç—å	X (–ø—Ä–∏–ª–∏–ø–∞—Ç—å) –∫ Y-—É	elkÀàin	NOM	SUP	Y	NOM_SUP		isttikan sttul-da-l alkÀàa-na	glass table-OBL-SUP stick.PFV-AOR	‚Äé‚Äé‚Äé‚ÄòThe glass got stuck to the table.‚Äô			
129	Lezgian_Yargun	82	lose#game#	X (lose) to Y	–ø—Ä–æ–∏–≥—Ä–∞—Ç—å	X (–ø—Ä–æ–∏–≥—Ä–∞—Ç—å) Y-—É	me«ßlub jen	NOM	DAT	Y	NOM_DAT		Sahib Eldar-a-z me«ßlub xha-na	PN PN-OBL-DAT defeated become.PFV-AOR	‚Äé‚Äé‚Äé‚ÄòSahib lost to Eldar.‚Äô			CV. Alternatives are ‚Äúuyun-d-a Sahib kumuqÀà-na‚Äù [game-OBL-IN PN remain.under-AOR] and ‚Äúuyun-d-a Sahib amuqÀà-na‚Äù [game-OBL-IN PN remain-AOR] where the Y argument is not overtly expressed.
129	Lezgian_Yargun	83	be_glad	X (be glad) about Y	—Ä–∞–¥–æ–≤–∞—Ç—å—Å—è	X (—Ä–∞–¥–æ–≤–∞—Ç—å—Å—è) Y-—É	≈üad jen	NOM	SUP	Y	NOM_SUP		Sahib mixhttub-da-l ≈üad xha-na	PN letter-OBL-SUP glad become.PFV-AOR	‚Äé‚Äé‚Äé‚ÄòSahib was glad about the letter.‚Äô			CV
129	Lezgian_Yargun	84	speak	X (speak) with Y	—Ä–∞–∑–≥–æ–≤–∞—Ä–∏–≤–∞—Ç—å	X (—Ä–∞–∑–≥–æ–≤–∞—Ä–∏–≤–∞—Ç—å) —Å Y-–æ–º	l√ºkÀàvenin	NOM	SUB/POSTgalaz	Y	NOM_SUB/POSTgalaz		Sahib Eldar-a galaz l√ºkÀàven-zva	PN PN-OBL(SUB/POST) with speak-PRS	‚Äé‚Äé‚Äé‚ÄòSahib is speaking with Eldar.‚Äô			
129	Lezgian_Yargun	85	give_birth	X (give birth) to Y	—Ä–æ–∂–∞—Ç—å	X (—Ä–æ–∂–∞—Ç—å) Y-–∞	jen	DAT	NOM	X	DAT_NOM		Lale-di-z sa gada xha-na	PN-OBL-DAT one son become.PFV-AOR	‚Äé‚Äé‚Äé‚ÄòLale gave birth to a son.‚Äô			Same verb as in 2, 42, different pattern. Alternative is ‚ÄúLale-di sa gada xa-na‚Äù [PN-ERG one son give_birth.IPFV/PFV-AOR] with the transitive pattern. Ayten did not mention any difference between the two structures in terms of naturalness/frequency. The reason I chose this one is because it is intransitive and also because it was reported by Ayten to be more ‚Äúpolite‚Äù. Finally, she also mentioned that the alternative transitive pattern is common with animals and implies some more intimate register.
129	Lezgian_Yargun	86	drop	X (drop) Y	—Ä–æ–Ω—è—Ç—å	X (—Ä–æ–Ω—è—Ç—å) Y	avatin	ADEL	NOM	X	ADEL_NOM		Sahib-a-vaa isttikan avat-na	PN-OBL-ADEL glass fall-AOR	‚Äé‚Äé‚Äé‚ÄòSahib dropped the glass.‚Äô			Same verb as 79, different pattern.
129	Lezgian_Yargun	87	govern	X (govern) Y	—Ä—É–∫–æ–≤–æ–¥–∏—Ç—å	X (—Ä—É–∫–æ–≤–æ–¥–∏—Ç—å) Y	√ßÀàexivalin	ERG	DAT	Y	ERG_DAT		Sahib-a ji x√ºr-√º-z √ßÀàexival-zva	PN-ERG 1PL.GEN village-OBL-DAT reign-PRS	‚Äé‚Äé‚Äé‚ÄòSahib runs our village.‚Äô			
129	Lezgian_Yargun	88	miss	X (miss) Y	—Å–∫—É—á–∞—Ç—å	X (—Å–∫—É—á–∞—Ç—å) –ø–æ Y-—É	vil gala (gala = locative copula)	GEN	SUB/POST	XY	GEN_SUB/POST	Non-verbal predicate.	Sahib-a-n Lale-di-k vil gala	PN-OBL-GEN PN-OBL-SUB/POST eye be.behind	‚Äé‚Äé‚Äé‚ÄòSahib misses Lale.‚Äô			Alternative is ‚ÄúSahib Lale-di-k darixmi»ô xha-nva‚Äù [PN PN-OBL-SUB/POST miss_VN become.PFV-PRF] with the NOM_SUB/POST pattern. I chose this version because the one with ‚Äúdarixmi»ô‚Äù is a direct borrowing from Azerbaijani. Besides, the structure I chose implies a stronger feeling that is typical of situation when one has not seen another person or a home village for a long time. "gala" est une copule locative, il n‚Äôy a pas de masdar ; mais on peut utiliser le verbe ‚Äòdevenir‚Äô jen.
129	Lezgian_Yargun	89	follow	X (follow) Y	—Å–ª–µ–¥–æ–≤–∞—Ç—å	X (—Å–ª–µ–¥–æ–≤–∞—Ç—å) –∑–∞ Y-–æ–º	avaz fin	NOM	GENccugvena	Y	NOM_GENccugvena	The combination "avaz fin" yields the relevant meaning only in combination with the postposition "cc√º«ßvena".	Sahib Eldar-a-n cc√º«ßvena ava-z fi-zva	PN PN-OBL-GEN behind.IN be.in-IMC go.IPFV/OP-PRS	‚Äé‚Äé‚Äé‚ÄòSahib follows Eldar.‚Äô			CV. ‚ÄúAvaz‚Äù is optional here. Here, cc√º«ßvena seems to function as a postposition. Here are Ayten‚Äôs comments on this: Il me semble que l√Ý, cc√º«ßvena fonctionne plut√¥t comme une postposition. On peut avoir le m√™me sens et exactement la m√™me structure avec un autre verbe¬Ý: hatin ‚Äòget‚Äô¬Ý(hat-nva au lieu de fi-zva). On peut d√©placer le g√©nitif (Eldaran) en d√©but de phrase pour focaliser tout le proc√®s¬Ý(le fait que les gens le suivent). Mais m√™me l√Ý, √ßa ne marche pas toujours. Lorsque l‚Äôobjet un seul terme (par ex. Sahib), on ne dira pas Eldar-a-n Sahib cc√º«ßvena (ava-z) fi-zva, on mettra l‚Äôobjet devant le verbe ‚Äòaller‚Äô¬Ý: Eldar-a-n cc√º«ßvena (ava-z) Sahib fi-zva. Lorsque l‚Äôobjet est compos√© de plusieurs termes, √ßa semble mieux marcher¬Ý: Eldar-a-n sa s√ºr√º ayalar cc√º«ßvena (ava-z) fi-zva ‚ÄòUn groupe d‚Äôenfants suivent Eldar‚Äô. Et on fait une pause apr√®s le sujet.
129	Lezgian_Yargun	90	dismount	X (get down) from Y	—Å–ª–µ–∑–∞—Ç—å	X (—Å–ª–µ–∑–∞—Ç—å) —Å Y-a (—Å –ª–æ—à–∞–¥–∏)	ivic‚Äôin	NOM	SUPEL	Y	NOM_SUPEL		Sahib ppalkkan-d-laa ivicÀà-na	PN horse-OBL-SUPEL descend-AOR	‚Äé‚Äé‚Äé‚ÄòSahib got down from the horse.‚Äô			
129	Lezgian_Yargun	91	listen	X (listen) to Y	—Å–ª—É—à–∞—Ç—å	X (—Å–ª—É—à–∞—Ç—å) Y	yob akalin	ERG	SUB/POST	Y	ERG_SUB/POST		Sahib-a raduva-di-k yob akal-zva	PN-ERG radio-OBL-SUB/POST ear join-PRS	‚Äé‚Äé‚Äé‚ÄòSahib is listening to radio.‚Äô			CV. Same verb as in 92, different pattern. Alternative is ‚ÄúSahib-a raduva-di-z yob gu-zva‚Äù [PN-ERG radio-OBL-DAT ear give.IPFV/MAS-PRS] with the ERG_DAT pattern. The reason I chose this one is bacause it was also suggested by Ramazan Mamedshaxov. Ayten maintains there is no semantic difference between the two structures.
129	Lezgian_Yargun	92	obey	X (obey) Y	—Å–ª—É—à–∞—Ç—å—Å—è	X (—Å–ª—É—à–∞—Ç—å—Å—è) Y-a	yob alazin	ERG	SUP	Y	ERG_SUP		Sahib-a dide-da-l yob alaa-zva	PN-ERG mother-OBL-SUP ear plonk-PRS	‚Äé‚Äé‚Äé‚ÄòSahib obeys his mother.‚Äô			CV. CV. Same verb as in 91, different pattern. Alternatives are ‚ÄúSahib-a dide-d √ßÀàal-a-z yob gu-zva‚Äù [PN-ERG mother-OBL(GEN) language-OBL-DAT ear give.IPFV/MAS-PRS] and ‚ÄúSahib-a dide-d √ßÀàal-a-z kilig-zva‚Äù [PN-ERG mother-OBL(GEN) language-OBL-DAT look-PRS], which do not meet the includion criteria because Y is expressed as an NP-internal modifier.
129	Lezgian_Yargun	93	hear	X (hear) Y	—Å–ª—ã—à–∞—Ç—å	X (—Å–ª—ã—à–∞—Ç—å) Y	van qven	DAT	GEN	XY	DAT_GEN	The NP in the genitive displays some properties of a clause-level dependent. 	Sahib-a-z sa ma ïni-di-n van qve-zva	PN-OBL-DAT one song-OBL-GEN noise come.IPFV-PRS	‚Äé‚Äé‚Äé‚ÄòSahib hears the song.‚Äô			CV. It is possible to move the genitive phrase around, cf. ma ïni-di-n Sahibaz van qve-zva, zaz va…Å ‚Äòla chanson, c‚Äôest Sahib qui l‚Äôentend, et pas moi‚Äô.
129	Lezgian_Yargun	94	mix	X (get mixed) with Y	—Å–º–µ—à–∞—Ç—å—Å—è	X (—Å–º–µ—à–∞—Ç—å—Å—è) —Å Y-–æ–º	akaxhin	NOM	SUB/POST	Y	NOM_SUB/POST		virt nikkedi-k akaxh-na	honey milk.OBL-SUB/POST mix-AOR	‚Äé‚Äé‚Äé‚ÄòThe honey got mixed with milk.‚Äô			Alternative is ‚Äúkakaxh-na‚Äù [mix-AOR] with the same valency structure.
129	Lezgian_Yargun	95	look	X (look) at Y	—Å–º–æ—Ç—Ä–µ—Ç—å	X (—Å–º–æ—Ç—Ä–µ—Ç—å) –Ω–∞ Y	kiligin	ERG	DAT	Y	ERG_DAT		Sahib-a √ßuf-ar-i-z kilig-zva	PN-ERG cloud-PL-OBL-DAT look-PRS	‚Äé‚Äé‚Äé‚ÄòSahib is looking at the clouds.‚Äô			
129	Lezgian_Yargun	96	take_off	X (take off) Y	—Å–Ω–∏–º–∞—Ç—å	X (—Å–Ω–∏–º–∞—Ç—å) Y (—Ä—É–±–∞—à–∫—É)	xttunin	ERG	NOM	TR	TR		Sahib-a pperem xttun-na	PN-ERG shirt take_off-AOR	‚Äé‚Äé‚Äé‚ÄòSahib took off his shirt.‚Äô			
129	Lezgian_Yargun	97	dream#sleeping#	X (dream) about Y	—Å–Ω–∏—Ç—å—Å—è	X-—É (—Å–Ω–∏—Ç—å—Å—è) Y	axvaraa akkvan	DAT	NOM	X	DAT_NOM		Sahib-a-z Lale akkva-zva axvar-aa	PN-OBL-DAT PN see.IPFV-PRS sleep-INEL	‚Äé‚Äé‚Äé‚ÄòSahib dreams about Lale.‚Äô			CV
129	Lezgian_Yargun	98	agree	X (agree) with Y	—Å–æ–≥–ª–∞—à–∞—Ç—å—Å—è	X (—Å–æ–≥–ª–∞—à–∞—Ç—å—Å—è) —Å Y-–æ–º	razi jen	NOM	SUB/POSTgalaz	Y	NOM_SUB/POSTgalaz		Sahib Lale-d galaz razi xha-na	PN PN-OBL(SUB/POST) with agreeing become.PFV-AOR	‚Äé‚Äé‚Äé‚ÄòSahib agreed with Lale.‚Äô			CV
129	Lezgian_Yargun	99	have_a_quarrel	X (have a quarrel) with Y	—Å—Å–æ—Ä–∏—Ç—å—Å—è	X (—Å—Å–æ—Ä–∏—Ç—å—Å—è) —Å –∫–µ–º Y	qal jen	NOM	SUB/POSTgalaz	Y	NOM_SUB/POSTgalaz		Sahib Lale-d galaz qal xha-na	PN PN-OBL(SUB/POST) with dispute become.PFV-AOR	‚Äé‚Äé‚Äé‚ÄòSahib had a quarrel with Lale.‚Äô			CV. Alternative is ‚ÄúSahib Lale-d galaz gaf-ar-a-l fe-na‚Äù [PN PN-OBL(SUB/POST) with word-PL-OBL-SUP go.PFV-AOR] with the same valency pattern.
129	Lezgian_Yargun	100	cost	X (cost) Y	—Å—Ç–æ–∏—Ç—å	X (—Å—Ç–æ–∏—Ç—å) Y (–æ–¥–∏–Ω –¥–æ–ª–ª–∞—Ä)	ya = COP	NOM	SUB/POST	Y	NOM_SUB/POST	Non-verbal predicate.	in √ßa»ôkka sa dollar-di-k ya	this cup one dollar-OBL-SUB/POST COP	‚Äé‚Äé‚Äé‚ÄòThis cup costs one dollar.‚Äô			ya est la copule d‚Äôidentification ; pas de masdar ; mais on peut utiliser le verbe ‚Äòdevenir‚Äô jen √Ý la place¬Ý;
129	Lezgian_Yargun	101	shoot_at	X (shoot) at Y	—Å—Ç—Ä–µ–ª—è—Ç—å	X (—Å—Ç—Ä–µ–ª—è—Ç—å) –≤ Y-–∞	g√ºlle aqhayin	ERG	DAT	Y	ERG_DAT		Sahib-a qu»ô-ra-z g√ºlle aqhaa-na	PN-ERG bird-OBL-DAT bullet open-AOR	‚Äé‚Äé‚Äé‚ÄòSahib shot at the bird.‚Äô			CV. Alternative is ‚ÄúSahib-a qu»ô ya ïa-na‚Äù [PN-ERG bird hit.PFV/IPFV-AOR] with the TR pattern but it implies that the bird was killed.
129	Lezgian_Yargun	102	pour	X (pour) Y	—Å—ã–ø–∞—Ç—å	X (—Å—ã–ø–∞—Ç—å) Y	vihin	ERG	NOM	TR	TR		Sahib-a √ßa»ôkka-di-z ppasuk vehe-na	PN-ERG cup-OBL-DAT caster_sugar throw.PFV-AOR	‚Äé‚Äé‚Äé‚ÄòSahib poured the sugar into the cup.‚Äô			
129	Lezgian_Yargun	103	lose	X (lose) Y	—Ç–µ—Ä—è—Ç—å	X (—Ç–µ—Ä—è—Ç—å) Y	kvadrin	ERG	NOM	TR	TR		Sahib-a a√ßar-ar kvadar-na	PN-ERG key-PL get_lost.CAUS-AOR	‚Äé‚Äé‚Äé‚ÄòSahib lost his keys.‚Äô			CAUS
129	Lezgian_Yargun	104	sink	X (sink) in Y	—Ç–æ–Ω—É—Ç—å	X (—Ç–æ–Ω—É—Ç—å) –≤ Y-–µ	batmi»ô jen	NOM	IN	Y	NOM_IN		kÀàan√ßÀà vac‚Äô-a batmi»ô xha-na	stump river-IN sink_VN become.PFV-AOR	‚Äé‚Äé‚Äé‚ÄòThe stump sank in the river.‚Äô			CV. Yad ‚Äòeau‚Äô donne √ß√ßa ‚Äòeau.IN‚Äô.
129	Lezgian_Yargun	105	kill	X (kill) Y	—É–±–∏–≤–∞—Ç—å	X (—É–±–∏–≤–∞—Ç—å) Y-–∞	req‚Äôin	ERG	NOM	TR	TR		Sahib-a murdar qÀàe-na	PN-ERG snake kill.PFV-AOR	‚Äé‚Äé‚Äé‚ÄòSahib killed the snake.‚Äô			
129	Lezgian_Yargun	106	hit	X (hit) Y	—É–¥–∞—Ä–∏—Ç—å	X (—É–¥–∞—Ä—è—Ç—å) Y-–∞	ya ïan	ERG	NOM	TR	TR		Sahib-a Eldar ya ïa-na	PN-ERG PN hit.PFV/IPFV-AOR	‚Äé‚Äé‚Äé‚ÄòSahib hit Eldar.‚Äô			Same as 34. The reason for the gloss PFV/IPFV is that with these verb, the stems are distributed as follows: ya ïa- hit.PFV/IPFV- vs. ya ïu- play.MAS-.
129	Lezgian_Yargun	107	kiss	X (kiss) Y	—Ü–µ–ª–æ–≤–∞—Ç—å	X (—Ü–µ–ª–æ–≤–∞—Ç—å) Y-–∞	siv gun	ERG	DAT	Y	ERG_DAT		Sahib-a Lale-di-z siv ga-na	PN-ERG PN-OBL-DAT mouth give.PFV-AOR	‚Äé‚Äé‚Äé‚ÄòSahib kissed Lale.‚Äô			CV. Alternative is ‚Äútemen ga-na‚Äù [kiss give.PFV-AOR] with the same pattern.
129	Lezgian_Yargun	108	read	X (read) Y	—á–∏—Ç–∞—Ç—å	X (—á–∏—Ç–∞—Ç—å) Y-–∞	k‚Äôelin	ERG	NOM	TR	TR		Sahib-a sa mara«ßlƒ± kittab kÀàel-na	PN-ERG one interesting book read-AOR	‚Äé‚Äé‚Äé‚ÄòSahib read an interesting book.‚Äô			
129	Lezgian_Yargun	109	move#bodypart#	X (move) Y	—à–µ–≤–µ–ª–∏—Ç—å	X (—à–µ–≤–µ–ª–∏—Ç—å) Y-–æ–º	uzurin	ERG	NOM	TR	TR		Sahib-a tÀàub uzu-r-na	PN-ERG finger shake.OP-CAUS-AOR	‚Äé‚Äé‚Äé‚ÄòSahib moved his finger.‚Äô			CAUS. Same as 43.
129	Lezgian_Yargun	110	respect	X (respect) Y	—É–≤–∞–∂–∞—Ç—å	X (—É–≤–∞–∂–∞—Ç—å) Y-–∞	h√ºrmetin	ERG	DAT	Y	ERG_DAT		Sahib-a Eldar-a-z h√ºrmet-zva	PN-ERG PN-OBL-DAT respect-PRS	‚Äé‚Äé‚Äé‚ÄòSahib respects Eldar.‚Äô			
129	Lezgian_Yargun	111	be_squeamish	X (be squeamish) about Y	–±—Ä–µ–∑–≥–æ–≤–∞—Ç—å	X (–±—Ä–µ–∑–≥–æ–≤–∞—Ç—å) Y-–æ–º	ttakkan qven	DAT	NOM	X	DAT_NOM		Sahib-a-z qÀàacÀàaa qappar tta-kkan qve-zva	PN-OBL-DAT dirty container.PL NEG-want come.IPFV-PRS	‚Äé‚Äé‚Äé‚ÄòSahib is squeamish about dirty dishes.‚Äô			CV
129	Lezgian_Yargun	112	be_content	X (be content) with	–±—ã—Ç—å –¥–æ–≤–æ–ª—å–Ω—ã–º	X (–±—ã—Ç—å –¥–æ–≤–æ–ª—å–Ω—ã–º) Y-–æ–º	razi + COP	NOM	SUPEL	Y	NOM_SUPEL	Non-verbal predicate.	Sahib vi√ß-i-n xi√ß√ßa-laa razi ya	PN self-OBL-GEN son.OBL-SUPEL satisfied COP	‚Äé‚Äé‚Äé‚ÄòSahib is satisfied with his son.‚Äô			ya = copule d‚Äôidentification ; pas de masdar ; mais on peut utiliser le verbe ‚Äòdevenir‚Äô jen √Ý la place
129	Lezgian_Yargun	113	fall_in_love	X (fall in love) with Y	–≤–ª—é–±–ª—è—Ç—å—Å—è	X (–≤–ª—é–±–ª—è—Ç—å—Å—è) –≤ Y-a	kkan jen	DAT	NOM	X	DAT_NOM		Sahib-a-z Lale kkan xha-na	PN-OBL-DAT PN love become.PFV-AOR	‚Äé‚Äé‚Äé‚ÄòSahib fell in love with Lale.‚Äô			CV. Same as 46, 119, 121.
129	Lezgian_Yargun	114	trust	X (trust) Y	–¥–æ–≤–µ—Ä—è—Ç—å	X (–¥–æ–≤–µ—Ä—è—Ç—å) Y-—É	ixtibarin	ERG	SUP	Y	ERG_SUP		Sahib-a Lale-da-l ixtibar-zva	PN-ERG PN-OBL-SUP trust-PRS	‚Äé‚Äé‚Äé‚ÄòSahib trusts Lale.‚Äô			
129	Lezgian_Yargun	115	sympathise	X (sympathise) with Y	–∂–∞–ª–µ—Ç—å	X (–∂–∞–ª–µ—Ç—å) Y-–∞	yuzux qven	DAT	GEN	XY	DAT_GEN	The NP in the genitive displays some properties of a clause-level dependent.	Sahib-a-z vi√ß-i-n dide-di-n yuzux qve-zva	PN-OBL-DAT self-OBL-GEN mother-OBL-GEN poor come.IPFV-PRS	‚Äé‚Äé‚Äé‚ÄòSahib sympathises with his mother.‚Äô			CV. It is possible to move the NP in the genitive around this sentence, cf. ‚Äúyuzux qve-zva ida-z vi√ß-i-n dide-di-n‚Äù [poor come.IPFV-PRS this.OBL-DAT self-OBL-GEN mother-OBL-GEN]. Ayten: ‚Äúmais cela est possible avec n‚Äôimporte quel g√©nitif !‚Äù
