language_no	language	predicate_no	predicate_label_en	argument_frame_en	predicate_label_ru	argument_frame_ru	verb	X	Y	locus	valency_pattern	comms	sentence	glosses_en	back_translation_en	glosses_ru	back_translation_ru	comms_internal
129	Lezgian_Yargun	1	feel_pain	X (have) Yache	–±–æ–ª–µ—Ç—å-1	—É X-–∞ (–±–æ–ª–µ—Ç—å) Y	tta jen	GEN	NOM	X	GEN_NOM	The NP in the genitive displays some properties of a clause-level dependent. 	Sahib-a-n qÀàil tta-zva	PN-OBL-GEN head have.pain-PRS	‚Äé‚Äé‚Äé‚ÄòSahib has a headache.‚Äô			It is possible to insert additional material between ‚ÄúSahib-a-n‚Äù and ‚ÄúqÀàil‚Äù, e.g., qe ppara pis, [today very bad].
129	Lezgian_Yargun	2	have#illness#	X (have) Y	–±–æ–ª–µ—Ç—å-2	X (–±–æ–ª–µ—Ç—å) Y-–æ–º	jen	NOM	NOM(NSBJ)	Y	NOM_NOM(NSBJ)		Sahib grip xha-nva	PN flu become.PFV-PRF	‚Äé‚Äé‚Äé‚ÄòSahib has the flu.‚Äô			Same verb as in 42, 85, different pattern. Alternative is the construction with the verb ‚Äúakatin‚Äù and the ‚ÄúSUB/POST_NOM‚Äù pattern: ‚ÄúSahib-a-k grip akat-nva‚Äù [PN-OBL-SUB/POST flu get-PRF].
129	Lezgian_Yargun	3	be_afraid	X (be afraid) of Y	–±–æ—è—Ç—å—Å—è	X (–±–æ—è—Ç—å—Å—è) Y-–∞	ki√ß‚Äôe jen	DAT	SUB/POSTEL	XY	DAT_SUB/POSTEL		Sahib-a-z ki√ßÀà-i-kaa ki√ßÀàe-zva	PN-OBL-DAT dog-OBL-SUB/POSTEL be.scared-PRS	‚Äé‚Äé‚Äé‚ÄòSahib is afraid of the dog.‚Äô			
129	Lezgian_Yargun	4	throw	X (throw) Y	–±—Ä–æ—Å–∏—Ç—å	X (–±—Ä–æ—Å–∏—Ç—å) Y(-–∞)	xkkadrin	ERG	NOM	TR	TR		Sahib-a qvan xkkadar-na	PN-ERG stone throw-AOR	‚Äé‚Äé‚Äé‚ÄòSahib threw a stone.‚Äô			
129	Lezgian_Yargun	5	have_enough	X (have enough) Y	–±—ã—Ç—å –¥–æ—Å—Ç–∞—Ç–æ—á–Ω–æ	X-—É (—Ö–≤–∞—Ç–∞—Ç—å) Y-–∞	bes jen	DAT	NOM	X	DAT_NOM		Sahib-a-z pul bes je-zva	PN-OBL-DAT money enough become.IPFV-PRS	‚Äé‚Äé‚Äé‚ÄòSahib has enough money.‚Äô			CV
129	Lezgian_Yargun	6	resemble	X (resemble) Y	–±—ã—Ç—å –ø–æ—Ö–æ–∂–∏–º	X (–±—ã—Ç—å –ø–æ—Ö–æ–∂–∏–º) –Ω–∞ Y(-–∞)	ux≈üar + COP	NOM	DAT	Y	NOM_DAT	Non-verbal predicate.	Sahib Eldar-a-z ux»ôar ya	PN PN-OBL-DAT like COP	‚Äé‚Äé‚Äé‚ÄòSahib resembles Eldar.‚Äô			ya = copule d‚Äôidentification ; pas de masdar ; mais on peut utiliser le verbe ‚Äòdevenir‚Äô jen √Ý la place.
129	Lezgian_Yargun	7	believe	X (believe) Y	–≤–µ—Ä–∏—Ç—å	X (–≤–µ—Ä–∏—Ç—å)Y-—É	√ß‚Äôalax + COP	NOM	SUP	Y	NOM_SUP	Non-verbal predicate.	Sahib Eldar-a-l √ßÀàalax ya	PN PN-OBL-SUP believing COP	‚Äé‚Äé‚Äé‚ÄòSahib believes Eldar.‚Äô			ya = copule d‚Äôidentification ; pas de masdar ; mais on peut utiliser le verbe ‚Äòdevenir‚Äô jen √Ý la place.
129	Lezgian_Yargun	8	take	X (take) Y	–≤–∑—è—Ç—å	X (–±—Ä–∞—Ç—å) Y(-–∞)	qa√ßun	ERG	NOM	TR	TR		Sahib-a kittab qa√ßu-na	PN-ERG book take-AOR	‚Äé‚Äé‚Äé‚ÄòSahib took a book.‚Äô			
129	Lezgian_Yargun	9	see	X (see) Y	–≤–∏–¥–µ—Ç—å	X (–≤–∏–¥–µ—Ç—å) Y(-–∞)	akkvan	DAT	NOM	X	DAT_NOM		Sahib-a-z kÀàval akkva-zva	PN-OBL-DAT house see.IPFV-PRS	‚Äé‚Äé‚Äé‚ÄòSahib sees the house.‚Äô			
129	Lezgian_Yargun	10	influence	X (influence) Y	–≤–ª–∏—è—Ç—å	X (–≤–ª–∏—è—Ç—å) –Ω–∞ Y(-–∞)	tesirin	ERG	DAT	Y	ERG_DAT		ya»ô-di yadda»ô-di-z tesir-zva	age-ERG memory-OBL-DAT influence-PRS	‚Äé‚Äé‚Äé‚ÄòAge influences memory.‚Äô			
129	Lezgian_Yargun	11	encounter	X (encounter) Y	–≤—Å—Ç—Ä–µ—á–∞—Ç—å—Å—è	X (–≤—Å—Ç—Ä–µ—á–∞—Ç—å—Å—è) —Å Y-–æ–º	haltin	NOM	SUP	Y	NOM_SUP		Sahib Eldar-a-l halt-na	PN PN-OBL-SUP meet-AOR	‚Äé‚Äé‚Äé‚ÄòSahib encountered Eldar.‚Äô			This verb is used for encounters taking place outdoors. As far as the protagonisthood is concerned, the crucial factor is not the case frame, but word order. In this sense, using the SUP_NOM pattern with the same word order (Sahib-a-l Eldar halt-na) would yield basically the same meaning.
129	Lezgian_Yargun	12	enter	X (enter) Y	–≤—Ö–æ–¥–∏—Ç—å 	X (–≤—Ö–æ–¥–∏—Ç—å) –≤ Y (–¥–æ–º)	haxhin	NOM	DAT	Y	NOM_DAT		Sahib kÀàval-i-z haxh-na	PN house-OBL-DAT enter-AOR	‚Äé‚Äé‚Äé‚ÄòSahib entered the house.‚Äô			
129	Lezgian_Yargun	13	win	X (beat) Y	–≤—ã–∏–≥—Ä–∞—Ç—å	X (–≤—ã–∏–≥—Ä—ã–≤–∞—Ç—å) —É Y-–∞	tuxun	ERG	NOM	TR	TR		Sahib-a Eldar tuxva-na	PN-ERG PN carry.PFV-AOR	‚Äé‚Äé‚Äé‚ÄòSahib beat Eldar.‚Äô			
129	Lezgian_Yargun	14	go_out	X (go out) of Y	–≤—ã—Ö–æ–¥–∏—Ç—å	X (–≤—ã—Ö–æ–¥–∏—Ç—å) –∏–∑ Y-–∞	aqatin	NOM	INEL	Y	NOM_INEL		Sahib kÀàval-aa aqat-na	PN house-INEL come_out-AOR	‚Äé‚Äé‚Äé‚ÄòSahib went out of the house.‚Äô			
129	Lezgian_Yargun	15	drive	X (drive) Y	–≥–Ω–∞—Ç—å	X (–≥–Ω–∞—Ç—å) Y-–∞	halin	ERG	NOM	TR	TR		Sahib-a kkal hal-zva	PN-ERG cow drive-PRS	‚Äé‚Äé‚Äé‚ÄòSahib is driving the cow.‚Äô			Alternative is ‚Äúhal-zva‚Äù [drive-PRS] with the same valency pattern.
129	Lezgian_Yargun	16	bend	X (bend) Y	–≥–Ω—É—Ç—å	X (–≥–Ω—É—Ç—å) Y	kakurin	ERG	NOM	TR	TR		Sahib-a ttar-a-n xel kaku-r-na	PN-ERG tree-OBL-GEN branch bend.OP-CAUS-AOR	‚Äé‚Äé‚Äé‚ÄòSahib bent the branch.‚Äô			CAUS
129	Lezgian_Yargun	17	tell	X (tell) Y	–≥–æ–≤–æ—Ä–∏—Ç—å	X (–≥–æ–≤–æ—Ä–∏—Ç—å) Y-—É	luhun	ERG	DAT	Y	ERG_DAT		Sahib-a Eldar-a-z laha-na	PN-ERG PN-OBL-DAT say.PFV-AOR	‚Äé‚Äé‚Äé‚ÄòSahib told Eldar.‚Äô			Same verb as in 51, 69, different pattern.
129	Lezgian_Yargun	18	hold	X (hold)Y	–¥–µ—Ä–∂–∞—Ç—å	X (–¥–µ—Ä–∂–∞—Ç—å) Y(-–∞)	qan	ERG	NOM	TR	TR		Sahib-a kittab qu-nva	PN-ERG book take.PFV/OP-PRF	‚Äé‚Äé‚Äé‚ÄòSahib is holding a book.‚Äô			Same as 43, 75, same verb as in 73.
129	Lezgian_Yargun	19	catch_up	X (catch up) with Y	–¥–æ–≥–Ω–∞—Ç—å	X (–¥–æ–≥–æ–Ω—è—Ç—å) Y(-–∞)	aga îin	NOM	AD	Y	NOM_AD		Sahib Samire-di-v aga î-na	PN PN-OBL-AD arrive-AOR	‚Äé‚Äé‚Äé‚ÄòSahib caught up with Samira.‚Äô			Same as 21.
129	Lezgian_Yargun	20	milk	X (milk) Y	–¥–æ–∏—Ç—å	X (–¥–æ–∏—Ç—å) Y-–∞	accan	ERG	NOM	TR	TR		Sahib-a kkal acca-na	PN-ERG cow milk.PFV/IPFV-AOR	‚Äé‚Äé‚Äé‚ÄòSahib milked the cow.‚Äô			The gloss like ‚ÄúPFV/IPFV‚Äù might look senseless, but in fact the verbs commonly distinguish between radical used in i) perfective forms, ii) imperfective forms and iii) masdar-like forms such as masdar itself, optative and sometimes imperative. So, the gloss here signals the stem that can be used in both perfective and imperfective forms, but not in the masdar-like series of forms, cf. accu- milk.MAS-.
129	Lezgian_Yargun	21	reach	X (reach) Y	–¥–æ—Å—Ç–∏—á—å	X (–¥–æ—Å—Ç–∏—á—å) Y-–∞ (–±–µ—Ä–µ–≥–∞) 	aga îin	NOM	AD	Y	NOM_AD		Sahib vacÀà-u-n qerex-di-v aga î-na	PN river-OBL-GEN shore-OBL-AD arrive-AOR	‚Äé‚Äé‚Äé‚ÄòSahib reached the bank.‚Äô			Same as 19.
129	Lezgian_Yargun	22	touch	X (touch) Y	–¥–æ—Ç—Ä–æ–Ω—É—Ç—å—Å—è	X (–¥–æ—Ç—Ä–∞–≥–∏–≤–∞—Ç—å—Å—è) –¥–æ Y-–∞	galuq‚Äôin	NOM	SUB/POST	Y	NOM_SUB/POST		Sahib cila-k galuqÀà-na	PN wall.OBL-SUB/POST touch-AOR	‚Äé‚Äé‚Äé‚ÄòSahib touched the wall.‚Äô			
129	Lezgian_Yargun	23	fight	X (fight) with Y	–¥—Ä–∞—Ç—å—Å—è	X (–¥—Ä–∞—Ç—å—Å—è) —Å Y-–æ–º	k(i)k‚Äôin	NOM	SUB/POSTgalaz	Y	NOM_SUB/POSTgalaz		Sahib Eldar-a galaz kikÀài-zva	PN PN-OBL(SUB/POST) with fight.IPFV-PRS	‚Äé‚Äé‚Äé‚ÄòSahib is fighting with Eldar.‚Äô			This is a tricky situation. The explicit SUB/POST case marker is not audible in the actual speech, but it can be pronounced with emphasis (Eldar-a-k(x) galaz is acceptable). For this reason, this form is analyzed as SUB/POSTgalaz.
129	Lezgian_Yargun	24	be_friends	X (be friends) with Y	–¥—Ä—É–∂–∏—Ç—å	X (–¥—Ä—É–∂–∏—Ç—å) —Å Y-–æ–º	dustvalin	NOM	SUB/POSTgalaz	Y	NOM_SUB/POSTgalaz		Sahib-a Eldar-a galaz dustval-zva	PN-ERG PN-OBL(SUB/POST) with have.friendship-PRS	‚Äé‚Äé‚Äé‚ÄòSahib is friends with Eldar.‚Äô			
129	Lezgian_Yargun	25	think	X (think) about Y	–¥—É–º–∞—Ç—å	X (–¥—É–º–∞—Ç—å) –æ–± Y-–µ (–æ–± –æ—Ç—Ü–µ)	fikirin	ERG	SUB/POSTEL	Y	ERG_SUB/POSTEL		Sahib-a Samire-d-kaa fikir-zva	PN-ERG PN-OBL-SUB/POSTEL think-PRS	‚Äé‚Äé‚Äé‚ÄòSahib is thinking about Samira.‚Äô			
129	Lezgian_Yargun	26	eat	X (eat) Y	–µ—Å—Ç—å	X (–µ—Å—Ç—å) Y	nen	ERG	NOM	TR	TR		Sahib-a i√ß tÀà√º-na	PN-ERG apple eat.PFV/OP-AOR	‚Äé‚Äé‚Äé‚ÄòSahib ate the apple.‚Äô			The reason for this pattern of glossing is the fact that the relationships between the three main stem can be different: mas = ipfv = pfv; mas = ipfv ¬π pfv; mas = pfv ¬π ipfv; ipfv = pfv ¬π mas; mas ¬π ipfv ¬π pfv. In this particular case, t‚Äô√º- eat.PFV/MAS is different from ne- eat.IPFV ‚Äì celui-l√Ý pour 3) toutes les formes imperfectives.
129	Lezgian_Yargun	27	fry	X (fry) Y	–∂–∞—Ä–∏—Ç—å	X (–∂–∞—Ä–∏—Ç—å) Y	qavurmi»ôin	ERG	NOM	TR	TR		Sahib-a «ßed qavurmi»ô-na	PN-ERG fish grill_VN-AOR	‚Äé‚Äé‚Äé‚ÄòSahib grilled the fish.‚Äô			
129	Lezgian_Yargun	28	wait	X (wait) for Y	–∂–¥–∞—Ç—å	X (–∂–¥–∞—Ç—å) Y-–∞ (—Å—ã–Ω–∞)	g√ºzlemi»ôin	ERG	NOM	TR	TR		Sahib-a Eldar g√ºzlemi»ô-zva	PN-ERG PN wait_VN-PRS	‚Äé‚Äé‚Äé‚ÄòSahib is waiting for Eldar.‚Äô			
129	Lezgian_Yargun	29	forget	X (forget) (about) Y	–∑–∞–±—ã–≤–∞—Ç—å	X (–∑–∞–±—ã–≤–∞—Ç—å) –æ–± Y-–µ	rik‚Äôalaa alatin	GEN	NOM	X	GEN_NOM	The NP in the genitive displays some properties of a clause-level dependent.	Sahib-a-n rikÀà-a-laa micci reqh alat-nva	PN-OBL-GEN heart-OBL-SUPEL other way pass-PRF	‚Äé‚Äé‚Äé‚ÄòSahib forgot about the other road.‚Äô			CV. It is possible to insert some material after ‚ÄúSahib-a-n‚Äù, e.g. ‚Äúiqandiqa‚Äù ‚Äòeveryday‚Äô.
129	Lezgian_Yargun	30	depend	X (depend) on Y	–∑–∞–≤–∏—Å–µ—Ç—å	X (–∑–∞–≤–∏—Å–µ—Ç—å) –æ—Ç Y-–∞	asƒ±llƒ± + COP	NOM	SUPEL	Y	NOM_SUPEL	Non-verbal predicate.	yadda»ô ya»ô-di-laa asƒ±llƒ± ya	memory age-OBL-SUPEL depending COP	‚Äé‚Äé‚Äé‚ÄòMemory depends on age.‚Äô			ya = copule d‚Äôidentification ; pas de masdar ; mais on peut utiliser le verbe ‚Äòdevenir‚Äô jen √Ý la place.
129	Lezgian_Yargun	31	call	X (call) Y	–∑–≤–∞—Ç—å	X (–∑–≤–∞—Ç—å) Y-–∞	everin	ERG	DAT	Y	ERG_DAT		Sahib-a Eldar-a-z ever-na	PN-ERG PN-OBL-DAT call-AOR	‚Äé‚Äé‚Äé‚ÄòSahib called Eldar.‚Äô			
129	Lezgian_Yargun	32	get_to_know	X (get to know) Y	–∑–Ω–∞–∫–æ–º–∏—Ç—å—Å—è	X (–∑–Ω–∞–∫–æ–º–∏—Ç—å—Å—è) —Å Y-–æ–º	tani≈ü jen	NOM	SUB/POSTgalaz	Y	NOM_SUB/POSTgalaz		Sahib Eldar-a galaz sa yis id-laa vilik tani»ô xhii-d-ya	PN PN-OBL(SUB/POST) with one year this.OBL-SUPEL before known become.AOP-SBST-COP	‚Äé‚Äé‚Äé'Sahib got to know Eldar a year ago.‚Äô			CV. AOP is aorist participle.
129	Lezgian_Yargun	33	know	X (know) Y	–∑–Ω–∞—Ç—å 	X (–∑–Ω–∞—Ç—å) Y-–∞	√ß√ßir jen	DAT	NOM	X	DAT_NOM		Sahib-a-z Eldar √ß√ßi-zva	PN-OBL-DAT PN know.IPFV-PRS	‚Äé‚Äé‚Äé‚ÄòSahib knows Eldar.‚Äô			
129	Lezgian_Yargun	34	play#instrument#	X (play) Y	–∏–≥—Ä–∞—Ç—å	X (–∏–≥—Ä–∞—Ç—å) –Ω–∞ Y-–µ	ya ïan	ERG	NOM	TR	TR		Sahib-a gittara ya ïa-zva	PN-ERG guitar play.PFV/IPFV-PRS	‚Äé‚Äé‚Äé‚ÄòSahib is playing the guitar.‚Äô			Same as 106. PFV/IPFV is used bacause here, the relationship between the stems is as follows: ya ïa- play.PFV/IPFV vs. ya ïu- play.MAS-. The same verb means ‚Äòto hit‚Äô.
129	Lezgian_Yargun	35	avoid	X (avoid) Y	–∏–∑–±–µ–≥–∞—Ç—å	X (–∏–∑–±–µ–≥–∞—Ç—å) Y-–∞	gahatiz eqven	NOM	SUB/POSTEL	Y	NOM_SUB/POSTEL		Sahib Eldar-a-kaa gahat-iz eqve-zva	PN PN-OBL-SUB/POSTEL run_away-IMC walk.PFV/IPFV-PRS	‚Äé‚Äé‚Äé‚ÄòSahib avoids Eldar.‚Äô			CV. Here, the relationship between the stems is as follows: eqve- walk.PFV/IPFV- vs. eq√º- walk.MAS-. IMC is imperfective converb.
129	Lezgian_Yargun	36	make	X (make) Y	–∏–∑–≥–æ—Ç–æ–≤–∏—Ç—å	X (–∏–∑–≥–æ—Ç–æ–≤–∏—Ç—å) Y	arasin	ERG	NOM	TR	TR		Sahib-a qÀàif-er qa-din djile aras-na	PN-ERG mouse-PL catch.IPFV-EVTPRT trap make-AOR	‚Äé‚Äé‚Äé‚ÄòSahib made a mousetrap.‚Äô			Ici, le verbe donne le sens de 'fabriquer'. Pour 'installer un pi√®ge' on a un autre verbe : kkgin.
129	Lezgian_Yargun	37	make_fun	X (make fun) of Y	–∏–∑–¥–µ–≤–∞—Ç—å—Å—è	X (–∏–∑–¥–µ–≤–∞—Ç—å—Å—è) –Ω–∞–¥ Y-–æ–º	qha√ßin	ERG	SUB/POSTEL	Y	ERG_SUB/POSTEL		Sahib-a Eldar-a-kaa qha√ß-zva	PN-ERG PN-OBL-SUB/POSTEL mock-PRS	‚Äé‚Äé‚Äé‚ÄòSahib is making fun of Eldar.‚Äô			
129	Lezgian_Yargun	38	have	X (have) Y	–∏–º–µ—Ç—å	X (–∏–º–µ—Ç—å) Y	ava = locative copula	DAT	NOM	X	DAT_NOM	Non-verbal predicate.	Sahib-a-z ma»ôin ava	PN-OBL-DAT car be.in	‚Äé‚Äé‚Äé‚ÄòSahib has a car.‚Äô			Same verb as 60, different pattern. ava est une copule locative, il n‚Äôy a pas de masdar ; mais on peut utiliser le verbe ‚Äòdevenir‚Äô jen √Ý la place
129	Lezgian_Yargun	39	look_for	X (look for) Y	–∏—Å–∫–∞—Ç—å	X (–∏—Å–∫–∞—Ç—å) Y(-–∞)	eqven	NOM	SUB/POST	Y	NOM_SUB/POST		Sahib a√ßaari-k eqve-zva	PN key.PL.OBL-SUB/POST search.PFV/IPFV-PRS	‚Äé‚Äé‚Äé‚ÄòSahib is looking for the keys.‚Äô			Alternative is ‚ÄúSahib-a a√ßar-ar √ß√ßa«ßu-r-zva‚Äù [PN-ERG key-PL find.MAS-CAUS-PRS]. There is not much difference between the two translations. However, the latter option with the verb √ß√ßaƒüurin there is an implication of some active imvolvement of the X-argument in the search activity. Moreover, some success can be also implied with this verb, as in Za vaz sa qhsan ru≈ü √ß√ßaƒüurnuva. ‚ÄòJ‚Äôai cherch√© et trouv√© pour toi une bonne fille (pour te marier).
129	Lezgian_Yargun	40	paint	X (paint) Y	–∫—Ä–∞—Å–∏—Ç—å	X (–∫—Ä–∞—Å–∏—Ç—å) Y	»ôir ya ïan	ERG	DAT	Y	ERG_DAT		Sahib-a √ßapar-di-z »ôir ya ïa-na	PN-ERG fence-OBL-DAT paint apply.PFV/IPFV-AOR	‚Äé‚Äé‚Äé‚ÄòSahib painted the wall.‚Äô			CV. PFV/IPFV is different from the masdar stem.
129	Lezgian_Yargun	41	bite	X (bite) Y	–∫—É—Å–∞—Ç—å	X (–∫—É—Å–∞—Ç—å) Y-–∞	k‚Äôasin	ERG	NOM	TR	TR		ki√ßÀà-i Sahib kÀàas-na	dog-ERG PN bite-AOR	‚Äé‚Äé‚Äé‚ÄòThe dog bit Sahib.‚Äô			
129	Lezgian_Yargun	42	forfeit	X (lose) Y	–ª–∏—à–∞—Ç—å—Å—è	X (–ª–∏—à–∞—Ç—å—Å—è) Y-–∞	jen	NOM	SUB/POSTEL	Y	NOM_SUB/POSTEL		Sahib kÀàval-i-kaa xha-na	PN house-OBL-SUB/POSTEL become.PFV-AOR	‚Äé‚Äé‚Äé‚ÄòSahib lost his house.‚Äô			Same verb as in 2, 85, different pattern. Ici, pour avoir le sens de ‚Äúperdre‚Äù, le cas post/subl√©latif sur le nom est obligatoire
129	Lezgian_Yargun	43	try_to_catch	X (try to catch) Y	–ª–æ–≤–∏—Ç—å	X (–ª–æ–≤–∏—Ç—å) Y(-–∞)	qan	ERG	NOM	TR	TR		Sahib-a kka√ß qa-zva	PN-ERG cat take.IPFV-PRS	‚Äé‚Äé‚Äé‚ÄòSahib is trying to catch the cat.‚Äô			Same as 18, 75, same verb as in 73.
129	Lezgian_Yargun	44	break	X (break) Y	–ª–æ–º–∞—Ç—å	X (–ª–æ–º–∞—Ç—å) Y	xan	ERG	NOM	TR	TR		Sahib-a tÀàval xa-na	PN-ERG stick break.IPFV/PFV-AOR	‚Äé‚Äé‚Äé‚ÄòSahib broke a stick.‚Äô			The reason for using the IPFV/PFV label is that for this verb, the three main stems have the following relationships: xa- break.PFV/IPFV- vs. xu- break.MAS-.
129	Lezgian_Yargun	45	flatter	X (flatter) Y	–ª—å—Å—Ç–∏—Ç—å	X (–ª—å—Å—Ç–∏—Ç—å) Y-—É	yaltaxlami»ô jen	NOM	DAT	Y	NOM_DAT		Sahib Samire-di-z yaltaxlami»ô je-zva	PN PN-OBL-DAT flatter_VN become.IPFV-PRS	‚Äé‚Äé‚Äé‚ÄòSahib is flattering Samira.‚Äô			CV
129	Lezgian_Yargun	46	love1	X (love) Y	–ª—é–±–∏—Ç—å-1	X (–ª—é–±–∏—Ç—å) Y-–∞ (—Å—ã–Ω–∞)	kkan jen	DAT	NOM	X	DAT_NOM		Sahib-a-z Lale kkan-zva	PN-OBL-DAT PN love-PRS	‚Äé‚Äé‚Äé‚ÄòSahib loves Lale.‚Äô			Same as 113, 119, 121.
129	Lezgian_Yargun	47	wave	X (wave) Y	–º–∞—Ö–∞—Ç—å	X (–º–∞—Ö–∞—Ç—å) Y-–æ–º	uzurin	ERG	NOM	TR	TR		Sahib-a yaylux uzu-r-zva	PN-ERG handkerchief shake.OP-CAUS-PRS	‚Äé‚Äé‚Äé‚ÄòSahib is waving a handkerchief.‚Äô			CAUS. Same as 109.
129	Lezgian_Yargun	48	dream	X (dream) of Y	–º–µ—á—Ç–∞—Ç—å	X (–º–µ—á—Ç–∞—Ç—å) –æ–± Y-–µ	arzulami»ôin	ERG	NOM	TR	TR		Sahib-a cÀàii ma»ôin arzulami»ô-zva	PN-ERG new car wish_VN-PRS	‚Äé‚Äé‚Äé‚ÄòSahib is dreaming of a new car.‚Äô			
129	Lezgian_Yargun	49	wash	X (wash) Y	–º—ã—Ç—å	X (–º—ã—Ç—å) Y	√ß√ºx√ºn	ERG	NOM	TR	TR		Sahib-a √ßa»ôkka √ß√ºxve-na	PN-ERG cup wash.PFV-AOR	‚Äé‚Äé‚Äé‚ÄòSahib washed the cup.‚Äô			
129	Lezgian_Yargun	50	put_on	X (put_on) Y	–Ω–∞–¥–µ–≤–∞—Ç—å	X (–Ω–∞–¥–µ–≤–∞—Ç—å) Y	aluq‚Äôin	ERG	NOM	TR	TR		Sahib-a »ôalvar aluqÀà-na	PN-ERG trousers dress-AOR	‚Äé‚Äé‚Äé‚ÄòSahib put on his trousers.‚Äô			
129	Lezgian_Yargun	51	be_called	X (be_called) Y	–Ω–∞–∑—ã–≤–∞—Ç—å—Å—è	X (–Ω–∞–∑—ã–≤–∞—Ç—å—Å—è) Y	luhun	DAT	NOM(NSBJ)	XY	DAT_NOM(NSBJ)		ida-z kompas luhu-da	this.OBL-DAT compass say.IPFV/OP-EVT	‚Äé‚Äé‚Äé‚ÄòThis is called a compass.‚Äô			Same verb as in 17, 69, different pattern. Alternative is ‚Äúin »ôe î-ini-n ttvar kompas ya‚Äù [this thing-OBL-GEN name compass COP] with the pattern GEN_NOM(NSBJ). There is not much difference between the two tranlations, but Ayten mentioned that ‚Äúc‚Äôest vrai que, quand il s‚Äôagit de noms de pays, de villes, j‚Äôutiliserais plus la phrase avec ttvar ‚Äònom‚Äô.¬Ý‚Äù.
129	Lezgian_Yargun	52	punish	X (punish) Y	–Ω–∞–∫–∞–∑—ã–≤–∞—Ç—å	X (–Ω–∞–∫–∞–∑—ã–≤–∞—Ç—å) Y-–∞	djeza gun	ERG	DAT	Y	ERG_DAT		Sahib-a vi√ß-i-n x√ß√ßi-z djeza ga-na	PN-ERG self-OBL-GEN son.OBL-DAT punishment give.PFV-AOR	‚Äé‚Äé‚Äé‚ÄòSahib punished his son.‚Äô			CV
129	Lezgian_Yargun	53	attack	X (attack) Y	–Ω–∞–ø–∞—Å—Ç—å	X (–Ω–∞–ø–∞–¥–∞—Ç—å) –Ω–∞ Y-–∞	h√ºdjumin	ERG	SUP	Y	ERG_SUP		sev-re «ßetter qa-zaa-d-a-l h√ºdjum-na	bear-ERG fish.PL catch.IPFV-PRSPRT-SBST-OBL-SUP attack-AOR	‚Äé‚Äé‚Äé‚ÄòThe bear attacked a fisherman.‚Äô			
129	Lezgian_Yargun	54	fill#intr#	X (fill) with Y	–Ω–∞–ø–æ–ª–Ω—è—Ç—å—Å—è	X (–Ω–∞–ø–æ–ª–Ω—è—Ç—å—Å—è) Y-–æ–º	ac‚Äôun	NOM	AD	Y	NOM_AD		vidre √ß√ßi-v acÀàa-na	pail water.OBL-AD fill.PFV-AOR	‚Äé‚Äé‚Äé‚ÄòThe bucket filled with water.‚Äô			
129	Lezgian_Yargun	55	find	X (find) Y	–Ω–∞—Ö–æ–¥–∏—Ç—å	X (–Ω–∞—Ö–æ–¥–∏—Ç—å) Y(-–∞)	√ß√ße«ßin	DAT	NOM	X	DAT_NOM		Sahib-a-z a√ßar-ar √ß√ßa«ßa-na	PN-OBL-DAT key-PL find.PFV-AOR	‚Äé‚Äé‚Äé‚ÄòSahib found the keys.‚Äô			Alternative is ‚Äúhat-na‚Äù [find-AOR] with the same valency pattern.
129	Lezgian_Yargun	56	be_short	X (be short) Y	–Ω–µ–¥–æ—Å—Ç–∞–≤–∞—Ç—å	X-—É (–Ω–µ–¥–æ—Å—Ç–∞–≤–∞—Ç—å) Y-a	aga îin + NEG	DAT	NOM	X	DAT_NOM		Sahib-a-z sa dollar aga î-za-»ô	PN-OBL-DAT one dollar reach-PRS-NEG	‚Äé‚Äé‚Äé‚ÄòSahib is one dollar short.‚Äô			
129	Lezgian_Yargun	57	hate	X (hate) Y	–Ω–µ–Ω–∞–≤–∏–¥–µ—Ç—å	X (–Ω–µ–Ω–∞–≤–∏–¥–µ—Ç—å) Y-–∞	ttakkan jen	DAT	NOM	X	DAT_NOM		Sahib-a-z Eldar tta-kkan-zva	PN-OBL-DAT PN NEG-love-PRS	‚Äé‚Äé‚Äé‚ÄòSahib hates Eldar.‚Äô			
129	Lezgian_Yargun	58	like	X (like) Y	–Ω—Ä–∞–≤–∏—Ç—å—Å—è	X-—É (–Ω—Ä–∞–≤–∏—Ç—å—Å—è) Y	xu≈ü qven	DAT	SUB/POSTEL	XY	DAT_SUB/POSTEL		Sahib-a-z in pperem-di-kaa xu»ô qve-zva	PN-OBL-DAT this shirt-OBL-SUB/POSTEL pleasant come.IPFV-PRS	‚Äé‚Äé‚Äé‚ÄòSahib likes this shirt.‚Äô			CV. Same as 129.
129	Lezgian_Yargun	59	need	X (need) Y	–Ω—É–∂–¥–∞—Ç—å—Å—è	X (–Ω—É–∂–¥–∞—Ç—å—Å—è) –≤ Y-–µ	lazim + COP	DAT	NOM	X	DAT_NOM	Non-verbal predicate.	Sahib-a-z pul lazim ya	PN-OBL-DAT money needful COP	‚Äé‚Äé‚Äé‚ÄòSahib needs money.‚Äô			Alternative is ‚Äúgerek‚Äù [necessary], also a non-verbal predicate with the same valency pattern. ya = copule d‚Äôidentification ; pas de masdar ; mais on peut utiliser le verbe ‚Äòdevenir‚Äô jen √Ý la place.
129	Lezgian_Yargun	60	surround	X (surround) Y	–æ–∫—Ä—É–∂–∞—Ç—å	X (–æ–∫—Ä—É–∂–∞—Ç—å) Y (—Å—Ç–µ–Ω–∞ –≥–æ—Ä–æ–¥)	ava = locative copula	GENyuqva	NOM	X	GENyuqva_NOM	Non-verbal predicate.	»ôeher cilar-i-n yuqÀàv-a ava	town wall.PL-OBL-GEN middle-IN be.in	‚Äé‚Äé‚Äé‚ÄòWalls surround the city.‚Äô			Same verb as 38, different pattern. ‚ÄúyuqÀàv-a‚Äù can be seen as a semi-grammaticalized postposition. The root Yuq‚Äôv originally means ‚Äòla taille‚Äô (partie du corps) ou ‚Äòle centre‚Äô. But here, the meaning is clightly modified so that the word is halfway to becoming a postposition.
129	Lezgian_Yargun	61	remain	X (have) Y left	–æ—Å—Ç–∞–≤–∞—Ç—å—Å—è	—É X-–∞ (–æ—Å—Ç–∞–≤–∞—Ç—å—Å—è) Y	ama = locative copula	DAT	NOM	X	DAT_NOM	Non-verbal predicate.	Sahib-a-z cÀàƒ±d dollar ama	PN-OBL-DAT ten dollar be.still	‚Äé‚Äé‚Äé‚ÄòSahib has ten dollars left.‚Äô			ama est une copule locative, il n‚Äôy a pas de masdar ; mais on peut utiliser le verbe ‚Äòrester‚Äô amuq‚Äôin √Ý la place¬Ý;
129	Lezgian_Yargun	62	answer	X (answer) Y	–æ—Ç–≤–µ—á–∞—Ç—å	X (–æ—Ç–≤–µ—á–∞—Ç—å) Y-—É	djavab gun	ERG	DAT	Y	ERG_DAT		Sahib-a ma ïlim-di-z djavab ga-na	PN-ERG teacher-OBL-DAT answer give.PFV-AOR	‚Äé‚Äé‚Äé‚ÄòSahib answered the teacher.‚Äô			CV
129	Lezgian_Yargun	63	open	X (open) Y	–æ—Ç–∫—Ä—ã–≤–∞—Ç—å	X (–æ—Ç–∫—Ä—ã–≤–∞—Ç—å) Y	aqhayin	ERG	NOM	TR	TR		Sahib-a bankka aqhay-na	PN-ERG jar open-AOR	‚Äé‚Äé‚Äé‚ÄòSahib opened a can.‚Äô			
129	Lezgian_Yargun	64	be_different	X (be different) from Y	–æ—Ç–ª–∏—á–∞—Ç—å—Å—è	X (–æ—Ç–ª–∏—á–∞—Ç—å—Å—è) –æ—Ç Y-–∞	ferqli + COP	NOM	SUPEL	Y	NOM_SUPEL	Non-verbal predicate.	zu pperem vi-d-laa ferqli ya	1SG.GEN shirt 2SG.GEN-SBST-SUPEL different COP	‚Äé‚Äé‚Äé‚ÄòMy shirt is different from yours.‚Äô			ya = copule d‚Äôidentification ; pas de masdar ; mais on peut utiliser le verbe ‚Äòdevenir‚Äô jen √Ý la place
