language_no	language	predicate_no	predicate_label_en	argument_frame_en	predicate_label_ru	argument_frame_ru	verb	X	Y	locus	valency_pattern	comms	sentence	glosses_en	back_translation_en	glosses_ru	back_translation_ru	comms_internal	verb_original_orthography	sentence_original_orthography
36	Serbian	1	feel_pain	X (have) Yache	болеть-1	у X-а (болеть) Y	boleti	ACC	NOM	X	ACC_NOM		Petr-a boli glav-a	PN-ACC.SG ache.PRS.3SG head-NOM.SG	‘Petar has a headache.’	PN-ACC.SG болеть.PRS.3SG голова-NOM.SG	‘У Петара болит голова.’		боли	Петр-а боли глав-а
36	Serbian	2	have#illness#	X (have) Y	болеть-2	X (болеть) Y-ом	imati	NOM	ACC	TR	TR		Petar ima grip	PN.NOM.SG have.PRS.3SG flu.ACC.SG	‘Petar has the flu.’	PN.NOM.SG иметь.PRS.3SG грипп.ACC.SG	‘Петар болеет гриппом.’	This is literally 'to have'	има	Петар има грип
36	Serbian	3	be_afraid	X (be afraid) of Y	бояться	X (бояться) Y-а	plašiti se	NOM	GEN	Y	NOM_GEN		Petar se plaši ps-a	PN.NOM.SG REFL frighten.PRS.3SG dog-GEN.SG	‘Petar is afraid of the dog.’	PN.NOM.SG REFL пугать.PRS.3SG собака-GEN.SG	‘Петар боится собаки.’	REFL	плаше се	Петар се плаши пс-а
36	Serbian	4	throw	X (throw) Y	бросить	X (бросить) Y(-а)	baciti	NOM	ACC	TR	TR		Petar je baci-o kamen	PN.NOM.SG be.PRS.3SG throw-PART.PERF.M.SG stone.ACC.SG	‘Petar threw a stone.’	PN.NOM.SG быть.PRS.3SG бросать-PART.PERF.M.SG камень.ACC.SG	‘Петар бросил камень.’		баци	Петар је баци-о камен
36	Serbian	5	have_enough	X (have enough) Y	быть достаточно	X-у (хватать) Y-а	imati dovoljno	*	*	*		Not included in the database because the intended meaning is expressed by a structurally discontinuous combination (predicate + NP-internal component).	Petar ima dovoljno novc-a	PN.NOM.SG have.PRS.3SG enough money-GEN.SG	‘Petar has enough money.’	PN.NOM.SG иметь.PRS.3SG достаточно деньги-GEN.SG	‘У Петара достаточно денег.’		има доволно	Петар има довољно новц-а
36	Serbian	6	resemble	X (resemble) Y	быть похожим	X (быть похожим) на Y(-а)	ličiti	NOM	naACC	Y	NOM_naACC		Petar liči na Marij-u	PN.NOM.SG resemble.PRS.3SG on PN-ACC.SG	‘Petar resembles Maria.’	PN.NOM.SG быть_похожим.PRS.3SG на PN-ACC.SG	‘Петар похож на Марию.’		личи	Петар личи на Мариј-у
36	Serbian	7	believe	X (believe) Y	верить	X (верить)Y-у	verovati	NOM	DAT	Y	NOM_DAT		Petar veruje Marij-i	PN.NOM.SG believe.PRS.3SG PN-DAT.SG	‘Petar believes Maria.’	PN.NOM.SG верить.PRS.3SG PN-DAT.SG	‘Петар верит Марии.’		веруjе	Петар верује Мариј-и
36	Serbian	8	take	X (take) Y	взять	X (брать) Y(-а)	uzeti	NOM	ACC	TR	TR		Petar je uze-o knjig-u	PN.NOM.SG be.PRS.3SG take-PART.PERF.M.SG book-ACC.SG	‘Petar took a book.’	PN.NOM.SG быть.PRS.3SG взять-PART.PERF.M.SG книга-ACC.SG	‘Петар взял книгу.’		узео	Петар је узе-о књиг-у
36	Serbian	9	see	X (see) Y	видеть	X (видеть) Y(-а)	videti	NOM	ACC	TR	TR		Petar vidi kuć-u	PN.NOM.SG see.PRS.3SG house-ACC.SG	‘Petar sees a house.’	PN.NOM.SG видеть.PRS.3SG дом-ACC.SG	‘Петар видит дом.’		види	Петар види кућ-у
36	Serbian	10	influence	X (influence) Y	влиять	X (влиять) на Y(-а)	uticati	NOM	naACC	Y	NOM_naACC		uzrast utiče na pamćenj-e	age.NOM.SG influence.PRS.3SG on memory-ACC.SG	‘Age influences memory.’	возраст.NOM.SG влиять.PRS.3SG на память-ACC.SG	‘Возраст влияет на пямять.’		утичи	узраст утиче на памћењ-е
36	Serbian	11	encounter	X (encounter) Y	встречаться	X (встречаться) с Y-ом	sresti	NOM	ACC	TR	TR		Petar je sre-o Marij-u	PN.NOM.SG be.PRS.3SG meet.PART.PERF.M.SG PN-ACC.SG	‘Petar encountered Maria.’	PN.NOM.SG быть.PRS.3SG встретить.PART.PERF.M.SG PN-ACC.SG	‘Петар встретил Марию.’		срео	Петар је сре-о Мариј-у
36	Serbian	12	enter	X (enter) Y	входить 	X (входить) в Y (дом)	ući	NOM	uACC	Y	NOM_uACC		Petar je uša-o u kuć-u	PN.NOM.SG be.PRS.3SG enter-PART.PERF.M.SG in house-ACC.SG	‘Petar entered the house.’	PN.NOM.SG быть.PRS.3SG войти-PART.PERF.M.SG в дом-ACC.SG	‘Петар вошел в дом.’		ушао	Петар је уша-о у кућ-у
36	Serbian	13	win	X (beat) Y	выиграть	X (выигрывать) у Y-а	pobediti	NOM	ACC	TR	TR		Petar je pobedi-o Marij-u	PN.NOM.SG be.PRS.3SG win-PART.PERF.M.SG PN-ACC.SG	‘Petar beat Maria.’	PN.NOM.SG быть.PRS.3SG победить-PART.PERF.M.SG PN-ACC.SG	‘Петар выиграл у Марии.’		победио	Петар је победи-о Мариј-у
36	Serbian	14	go_out	X (go out) of Y	выходить	X (выходить) из Y-а	izaći	NOM	izGEN	Y	NOM_izGEN		Petar je izaša-o iz kuć-e	PN.NOM.SG be.PRS.3SG go.out-PART.PERF.M.SG from house-GEN.SG	‘Petar went out of the house.’	PN.NOM.SG быть.PRS.3SG выйти-PART.PERF.M.SG из дом-GEN.SG	‘Петар вышел из дома.’		изашао	Петар је изаша-о из кућ-е
36	Serbian	15	drive	X (drive) Y	гнать	X (гнать) Y-а	terati	NOM	ACC	TR	TR		Petar tera krav-u	PN.NOM.SG drive.PRS.3SG cow-ACC.SG	‘Petar is driving the cow.’	PN.NOM.SG гнать.PRS.3SG корова-ACC.SG	‘Петар гонит корову.’		тера	Петар тера крав-у
36	Serbian	16	bend	X (bend) Y	гнуть	X (гнуть) Y	saviti	NOM	ACC	TR	TR		Petar je savi-o gran-u	PN.NOM.SG be.PRS.3SG bend-PART.PERF.M.SG branch-ACC.SG	‘Petar bent the branch.’	PN.NOM.SG быть.PRS.3SG согнуть-PART.PERF.M.SG ветка-ACC.SG	‘Петар согнул ветку.’		савио	Петар је сави-о гран-у
36	Serbian	17	tell	X (tell) Y	говорить	X (говорить) Y-у	reći	NOM	DAT	Y	NOM_DAT		Petar je reka-o Marij-i	PN.NOM.SG be.PRS.3SG tell-PART.PERF.M.SG PN-DAT.SG	‘Petar told Maria.’	PN.NOM.SG быть.PRS.3SG сказать-PART.PERF.M.SG PN-DAT.SG	‘Петар сказал Марии.’		рекао	Петар је река-о Мариј-и
36	Serbian	18	hold	X (hold)Y	держать	X (держать) Y(-а)	držati	NOM	ACC	TR	TR		Petar drži knjig-u	PN.NOM.SG hold.PRS.3SG book-ACC.SG	‘Petar is holding a book.’	PN.NOM.SG держать.PRS.3SG книга-ACC.SG	‘Петар держит книгу.’		држи	Петар држи књиг-у
36	Serbian	19	catch_up	X (catch up) with Y	догнать	X (догонять) Y(-а)	stići	NOM	ACC	TR	TR		Petar je stiga-o Marij-u	PN.NOM.SG be.PRS.3SG catch.up-PART.PERF.M.SG PN-ACC.SG	‘Petar caught up with Maria.’	PN.NOM.SG быть.PRS.3SG догнать-PART.PERF.M.SG PN-ACC.SG	‘Петар догнал Марию.’	Same verb as in 21, different pattern	стигао	Петар је стига-о Мариј-у
36	Serbian	20	milk	X (milk) Y	доить	X (доить) Y-а	pomusti	NOM	ACC	TR	TR		Petar je pomuza-o krav-u	PN.NOM.SG be.PRS.3SG milk-PART.PERF.M.SG cow-ACC.SG	‘Petar milked the cow.’	PN.NOM.SG быть.PRS.3SG подоить-PART.PERF.M.SG корова-ACC.SG	‘Петар подоил корову.’		помузао	Петар је помуза-о крав-у
36	Serbian	21	reach	X (reach) Y	достичь	X (достичь) Y-а (берега) 	stići	NOM	doGEN	Y	NOM_doGEN		Petar je stiga-o do obal-e	PN.NOM.SG be.PRS.3SG reach-PART.PERF.M.SG up.to bank-GEN.SG.F	‘Petar reached the bank.’	PN.NOM.SG быть.PRS.3SG достичь-PART.PERF.M.SG до берег-GEN.SG.F	‘Петар достиг берега.’	Same verb as in 19, different pattern	стигао	Петар је стига-о до обал-е
36	Serbian	22	touch	X (touch) Y	дотронуться	X (дотрагиваться) до Y-а	dodirnuti	NOM	ACC	TR	TR		Petar je dodirnu-o zid	PN.NOM.SG be.PRS.3SG touch-PART.PERF.M.SG wall.ACC.SG	‘Petar touched the wall.’	PN.NOM.SG быть.PRS.3SG дотронуться-PART.PERF.M.SG стена.ACC.SG	‘Петар дотронулся до стены.’		додирнуо	Петар је додирну-о зид
36	Serbian	23	fight	X (fight) with Y	драться	X (драться) с Y-ом	tucati se	NOM	sINS	Y	NOM_sINS		Petar se tuče sa Mark-om	PN.NOM.SG REFL hit.PRS.3SG with PN-INS.SG	‘Petar is fighting with Mark.’	PN.NOM.SG REFL бить.PRS.3SG с PN-INS.SG	‘Петар дерется с Марком.’	REFL. This preposition is sometimes sa (incl. here) and sometimes s.	тучи се	Петар се туче са Марком
36	Serbian	24	be_friends	X (be friends) with Y	дружить	X (дружить) с Y-ом	družiti se	NOM	sINS	Y	NOM_sINS		Petar se druži sa Marij-om	PN.NOM.SG REFL be.friends.PRS.3SG with PN-INS.SG	‘Petar is friends with Maria.’	PN.NOM.SG REFL дружить.PRS.3SG с PN-INS.SG	‘Петар дружит с Марией.’	REFL. This preposition is sometimes sa (incl. here) and sometimes s.	дружи се	Петар се дружи са Мариј-ом
36	Serbian	25	think	X (think) about Y	думать	X (думать) об Y-е (об отце)	misliti	NOM	naACC	Y	NOM_naACC		Petar misli na Marij-u	PN.NOM.SG think.PRS.3SG on PN-ACC.SG	‘Petar is thinking about Maria.’	PN.NOM.SG думать.PRS.3SG на PN-ACC.SG	‘Петар думает о Марии.’	Alternative is NOM_oLOC: Петар мисли о Мариј-и [Петар.NOM думать.PRS.3SG o Мария-LOC]	мисли	Петар мисли на Мариј-у
36	Serbian	26	eat	X (eat) Y	есть	X (есть) Y	pojesti	NOM	ACC	TR	TR		Petar je poje-o jabuk-u	PN.NOM.SG be.PRS.3SG eat-PART.PERF.M.SG apple-ACC.SG	‘Petar ate an apple.’	PN.NOM.SG быть.PRS.3SG съесть-PART.PERF.M.SG яблоко-ACC.SG	‘Петар съел яблоко.’		поjео	Петар је поје-о јабук-у
36	Serbian	27	fry	X (fry) Y	жарить	X (жарить) Y	ispržiti	NOM	ACC	TR	TR		Petar je isprži-o rib-u	PN.NOM.SG be.PRS.3SG fry-PART.PERF.M.SG fish-ACC.SG	‘Petar fried the fish.’	PN.NOM.SG быть.PRS.3SG пожарить-PART.PERF.M.SG рыба-ACC.SG	‘Петар пожарил рыбу.’		испржио	Петар је испржи-о риб-у
36	Serbian	28	wait	X (wait) for Y	ждать	X (ждать) Y-а (сына)	čekati	NOM	ACC	TR	TR		Petar čeka Marij-u	PN.NOM.SG wait.PRS.3SG PN-ACC.SG	‘Petar is waiting for Maria.’	PN.NOM.SG ждать.PRS.3SG PN-ACC.SG	‘Петар ждет Марию.’		чека	Петар чека Мариј-у
36	Serbian	29	forget	X (forget) (about) Y	забывать	X (забывать) об Y-е	zaboraviti	NOM	naACC	Y	NOM_naACC		Petar je zaboravi-o na drug-i put	PN.NOM.SG be.PRS.3SG forget-PART.PERF.M.SG on other-ACC.SG.M road.ACC.SG	‘Petar forgot about the other road.’	PN.NOM.SG быть.PRS.3SG забыть-PART.PERF.M.SG на другой-ACC.SG.M дорога.ACC.SG	‘Петар забыл о другой дороге.’		заборавио	Петар је заборави-о на друг-и пут
36	Serbian	30	depend	X (depend) on Y	зависеть	X (зависеть) от Y-а	zavisiti	NOM	odGEN	Y	NOM_odGEN		Pamćenj-e zavisi od uzrast-a	memory-NOM.SG depend.PRS.3SG from.near age-GEN.SG	‘Memory depends on age.’	память-NOM.SG зависеть.PRS.3SG от возраст-GEN.SG	‘Память зависит от возраста.’		зависи	Памћењ-е зависи од узраст-а
36	Serbian	31	call	X (call) Y	звать	X (звать) Y-а	pozvati	NOM	ACC	TR	TR		Petar je pozva-o Marij-u	PN.NOM.SG be.PRS.3SG call-PART.PERF.M.SG PN-ACC.SG	‘Petar called Maria.’	PN.NOM.SG быть.PRS.3SG позвать-PART.PERF.M.SG PN-ACC.SG	‘Петар позвал Марию.’		позвао	Петар је позва-о Мариј-у
36	Serbian	32	get_to_know	X (get to know) Y	знакомиться	X (знакомиться) с Y-ом	upoznati	NOM	ACC	TR	TR		Petar je upozna-o Marij-u pre godin-u dan-a	PN.NOM.SG be.PRS.3SG get.to.know-PART.PERF.M.SG PN-ACC.SG in.front year-ACC.SG day-GEN.PL	‘Petar got to know Maria a year ago.’	PN.NOM.SG быть.PRS.3SG узнать-PART.PERF.M.SG PN-ACC.SG перед год-ACC.SG день-GEN.PL	‘Петар познакомился с Марией год тому назад.’		упознао	Петар је упозна-о Мариј-у пре годин-у дан-а
36	Serbian	33	know	X (know) Y	знать 	X (знать) Y-а	poznavati	NOM	ACC	TR	TR		Petar poznaje Marij-u	PN.NOM.SG know.PRS.3SG PN-ACC.SG	‘Petar knows Maria.’	PN.NOM.SG знать.PRS.3SG PN-ACC.SG	‘Петар знает Марию.’		познаjе	Петар познаје Мариј-у
36	Serbian	34	play#instrument#	X (play) Y	играть	X (играть) на Y-е	svirati	NOM	ACC	TR	TR		Petar svira gitar-u	PN.NOM.SG play.PRS.3SG guitar-ACC.SG	‘Petar is playing the guitar.’	PN.NOM.SG играть.PRS.3SG гитара-ACC.SG	‘Петар играет на гитаре.’		свира	Петар свира гитар-у
36	Serbian	35	avoid	X (avoid) Y	избегать	X (избегать) Y-а	izbegavati	NOM	ACC	TR	TR		Petar izbegava Marij-u	PN.NOM.SG avoid.PRS.3SG PN-ACC.SG	‘Petar avoids Maria.’	PN.NOM.SG избегать.PRS.3SG PN-ACC.SG	‘Петар избегает Марию.’		избегава	Петар избегава Марију
36	Serbian	36	make	X (make) Y	изготовить	X (изготовить) Y	napraviti	NOM	ACC	TR	TR		Petar je napravi-o bomb-u	PN.NOM.SG be.PRS.3SG make-PART.PERF.M.SG bomb-ACC.SG	‘Petar made a bomb.’	PN.NOM.SG быть.PRS.3SG сделать-PART.PERF.M.SG бомба-ACC.SG	‘Петар сделал бомбу.’		направио	Петар је направи-о бомб-у
36	Serbian	37	make_fun	X (make fun) of Y	издеваться	X (издеваться) над Y-ом	maltretirati	NOM	ACC	TR	TR		Petar maltretira Marij-u	PN.NOM.SG make.fun.PRS.3SG PN-ACC.SG	‘Petar is making fun of Maria.’	PN.NOM.SG издеваться.PRS.3SG PN-ACC.SG	‘Петар издевается над Марией.’		малтретира	Петар малтретира Мариј-у
36	Serbian	38	have	X (have) Y	иметь	X (иметь) Y	imati	NOM	ACC	TR	TR		Petar ima kol-a	PN.NOM.SG have.PRS.3SG car-ACC.PL	‘Petar has a car.’	PN.NOM.SG иметь.PRS.3SG машина-ACC.PL	‘У Петара есть машина.’		има	Петар има кол-а
36	Serbian	39	look_for	X (look for) Y	искать	X (искать) Y(-а)	tražiti	NOM	ACC	TR	TR		Petar traži ključ-eve	PN.NOM.SG look.for.PRS.3SG key-ACC.PL	‘Petar is looking for his keys.’	PN.NOM.SG искать.PRS.3SG ключ-ACC.PL	‘Петар ищет ключи.’		тражи	Петар тражи кључ-еве
36	Serbian	40	paint	X (paint) Y	красить	X (красить) Y	ofarbati	NOM	ACC	TR	TR		Petar je ofarba-o ograd-u	PN.NOM.SG be.PRS.3SG paint-PART.PERF.M.SG fence-ACC.SG	‘Petar painted the fence.’	PN.NOM.SG быть.PRS.3SG покрасить-PART.PERF.M.SG забор-ACC.SG	‘Петар покрасил забор.’		офарбао	Петар је офарба-о оград-у
36	Serbian	41	bite	X (bite) Y	кусать	X (кусать) Y-а	ujesti	NOM	ACC	TR	TR		Pas je uje-o Petr-a	dog.NOM.SG be.PRS.3SG bite-PART.PERF.M.SG PN-ACC.SG	‘A dog bit Petar.’	собака.NOM.SG быть.PRS.3SG укусить-PART.PERF.M.SG PN-ACC.SG	‘Собака укусила Петара.’		уjе	Пас је ује-о Петр-а
36	Serbian	42	forfeit	X (lose) Y	лишаться	X (лишаться) Y-а	ostati	NOM	bezGEN	Y	NOM_bezGEN		Petar je osta-o bez kuć-e	PN.NOM.SG be.PRS.3SG remain-PART.PERF.M.SG without house-GEN.SG	‘Petar lost his house.’	PN.NOM.SG быть.PRS.3SG остаться-PART.PERF.M.SG бeз дом-GEN.SG	‘Петар остался без дома.’		остао	Петар је оста-о без кућ-е
36	Serbian	43	try_to_catch	X (try to catch) Y	ловить	X (ловить) Y(-а)	juriti	NOM	ACC	TR	TR		Petar juri mačk-u	PN.NOM.SG try.to.catch.PRS.3SG cat-ACC.SG	‘Petar is trying to catch the cat.’	PN.NOM.SG ловить.PRS.3SG кошка-ACC.SG	‘Петар ловит кошку.’		jури	Петар јури мачк-у
36	Serbian	44	break	X (break) Y	ломать	X (ломать) Y	polomiti	NOM	ACC	TR	TR		Petar je polomi-o štap	PN.NOM.SG be.PRS.3SG break-PART.PERF.M.SG stick.ACC.SG	‘Petar broke a stick.’	PN.NOM.SG быть.PRS.3SG сломать-PART.PERF.M.SG палка.ACC.SG	‘Петар сломал палку.’		поломио	Петар је поломи-о штап
36	Serbian	45	flatter	X (flatter) Y	льстить	X (льстить) Y-у	laskati	NOM	DAT	Y	NOM_DAT		Petar laska Marij-i	PN.NOM.SG flatter.PRS.3SG PN-DAT.SG	‘Petar is flattering Maria.’	PN.NOM.SG льстить.PRS.3SG PN-DAT.SG	‘Петар льстит Марии.’		ласка	Петар ласка Мариј-и
36	Serbian	46	love1	X (love) Y	любить-1	X (любить) Y-а (сына)	voleti	NOM	ACC	TR	TR		Petar voli Marij-u	PN.NOM.SG love.PRS.3SG PN-ACC.SG	‘Petar loves Maria.’	PN.NOM.SG любить.PRS.3SG PN-ACC.SG	‘Петар любит Марию.’		воли	Петар воли Мариј-у
36	Serbian	47	wave	X (wave) Y	махать	X (махать) Y-ом	mahati	NOM	INS	Y	NOM_INS		Petar maše maram-om	PN.NOM.SG wave.PRS.3SG handkerchief-INS.SG.F	‘Petar is waving a handkerchief.’	PN.NOM.SG махать.PRS.3SG платок-INS.SG.F	‘Петар машет платком.’		маше	Петар маше марам-ом
36	Serbian	48	dream	X (dream) of Y	мечтать	X (мечтать) об Y-е	maštati	NOM	oLOC	Y	NOM_oLOC		Petar mašta o nov-im kol-ima	PN.NOM.SG dream.PRS.3SG about new.LOC.PL.N car-LOC.PL	‘Petar is dreaming of a new car.’	PN.NOM.SG мечтать.PRS.3SG о новый.LOC.PL.N машина-LOC.PL	‘Петар мечтает о новой машине.’		машта	Петар машта о нов-им кол-има
36	Serbian	49	wash	X (wash) Y	мыть	X (мыть) Y	oprati	NOM	ACC	TR	TR		Petar je opra-o šolj-u	PN.NOM.SG be.PRS.3SG wash-PART.PERF.M.SG cup-ACC.SG	‘Petar washed the cup.’	PN.NOM.SG быть.PRS.3SG вымыть-PART.PERF.M.SG чашка-ACC.SG	‘Петар вымыл чашку.’		опрао	Петар је опра-о шољ-у
36	Serbian	50	put_on	X (put_on) Y	надевать	X (надевать) Y	obući	NOM	ACC	TR	TR		Petar je obuka-o pantalon-e	PN.NOM.SG be.PRS.3SG put.on-PART.PERF.M.SG trousers-ACC.PL	‘Petar put on his trousers.’	PN.NOM.SG быть.PRS.3SG надеть-PART.PERF.M.SG штаны-ACC.PL	‘Петар надел штаны.’		обукао	Петар је обука-о панталон-е
36	Serbian	51	be_called	X (be_called) Y	называться	X (называться) Y	zvati se	NOM	NOM	Y	NOM_NOM		taj predmet se zove kompas	this.NOM.SG.M object.NOM.SG REFL call.PRS.3SG compass.NOM.SG	‘This object is called a compass.’	этот.NOM.SG.M предмет.NOM.SG REFL звать.PRS.3SG компас.NOM.SG	‘Этот предмет называется компас.’	REFL	зове се	тај предмет се зове компас
36	Serbian	52	punish	X (punish) Y	наказывать	X (наказывать) Y-а	kazniti	NOM	ACC	TR	TR		Petar je kazni-o sv-og sin-a	PN.NOM.SG be.PRS.3SG punish-PART.PERF.M.SG one’s-ACC.SG son-ACC.SG	‘Petar punished his son.’	PN.NOM.SG быть.PRS.3SG наказать-PART.PERF.M.SG свой-ACC.SG сын-ACC.SG	‘Петар наказл своего сына.’		казнио	Петар је казни-о св-ог син-а
36	Serbian	53	attack	X (attack) Y	напасть	X (нападать) на Y-а	napasti	NOM	ACC	TR	TR		medved je napa-o pecaroš-a	PN.NOM.SG be.PRS.3SG attack-PART.PERF.M.SG fisherman-ACC.SG	‘A bear attacked a fisherman.’	PN.NOM.SG быть.PRS.3SG напасть-PART.PERF.M.SG рыбак-ACC.SG	‘Медведь напал на рыбака.’		напао	медвед је напа-о пецарош-а
36	Serbian	54	fill#intr#	X (fill) with Y	наполняться	X (наполняться) Y-ом	napuniti se	NOM	INS	Y	NOM_INS		kof-a se napuni-la vod-om	bucket.NOM.SG.F REFL fill-PART.PERF.F.SG water-INS.SG	‘The bucket filled with water.’	ведро.NOM.SG.F REFL наполнять-PART.PERF.F.SG вода-INS.SG	‘Ведро наполнилось водой.’	REFL	напулнила се	коф-а се напуни-ла вод-ом
36	Serbian	55	find	X (find) Y	находить	X (находить) Y(-а)	naći	NOM	ACC	TR	TR		Petar je naša-o ključ-eve	PN.NOM.SG be.PRS.3SG find-PART.PERF.M.SG key-АCC.PL	‘Petar found his keys.’	PN.NOM.SG быть.PRS.3SG найти-PART.PERF.M.SG ключ-АCC.PL	‘Петар нашел ключи.’		нашао	Петар је наша-о кључ-еве
36	Serbian	56	be_short	X (be short) Y	недоставать	X-у (недоставать) Y-a	faliti	DAT	NOM	X	DAT_NOM		Petr-u fali jedan dolar	PN-DAT.SG lack.PRS.3SG one.NOM.SG dollar.NOM.SG 	‘Petar is one dollar short.’	PN-DAT.SG недоставать.PRS.3SG один.NOM.SG доллар.NOM.SG 	‘Петру недостает одного доллара.’		фали	Петр-у фали један долар
36	Serbian	57	hate	X (hate) Y	ненавидеть	X (ненавидеть) Y-а	mrzeti	NOM	ACC	TR	TR		Petar mrzi Marij-u	PN.NOM.SG hate.PRS.3SG PN-ACC.SG	‘Petar hates Maria.’	PN.NOM.SG ненавидеть.PRS.3SG PN-ACC.SG	‘Петар ненавидит Марию.’		мрзи	Петар мрзи Мариј-у
36	Serbian	58	like	X (like) Y	нравиться	X-у (нравиться) Y	sviđati se	DAT	NOM	X	DAT_NOM		Petr-u se sviđa ta košulj-a	PN-DAT.SG REFL like.PRS.3SG this.NOM.SG.F shirt-NOM.SG	‘Petar likes this shirt.’	PN-DAT.SG REFL нравиться.PRS.3SG этот.NOM.SG.F рубашка-NOM.SG	‘Петру нравится эта рубашка.’	REFL	свича се	Петр-у се свиђа та кошуљ-а
36	Serbian	59	need	X (need) Y	нуждаться	X (нуждаться) в Y-е	biti potreban	DAT	NOM	X	DAT_NOM	Non-verbal predicate	Petr-u je potreban novac	PN-DAT.SG be.PRS.3SG necessary.NOM.SG money.NOM.SG	‘Petar needs money.’	PN-DAT.SG быть.PRS.3SG необходим.NOM.SG деньги.NOM.SG	‘Петару нужны деньги.’		потребан	Петр-у је потребан новац
36	Serbian	60	surround	X (surround) Y	окружать	X (окружать) Y (стена город)	biti opasan	INS	NOM	X	INS_NOM	Non-verbal predicate (passive).	grad je opasan zidin-ama	city.NOM.SG be.PRS.3SG surround.PART.PASS.NOM.SG.M city_wall-INS.PL	‘Walls surround the city.’	город.NOM.SG быть.PRS.3SG окружить.PART.PASS.NOM.SG.M городская_стена-INS.PL	‘Город окружен стеной.’		опасан	град је опасан зидин-ама
36	Serbian	61	remain	X (have) Y left	оставаться	у X-а (оставаться) Y	ostati	DAT	NOM	X	DAT_NOM		Petr-u je osta-lo deset dolar-a	PN-DAT.SG be.PRS.3SG remain-PART.PERF.N.SG ten dollar-GEN.PL	‘Petar has ten dollars left.’	PN-DAT.SG быть.PRS.3SG остаться-PART.PERF.N.SG десять доллар-GEN.PL	‘У Петара осталось 10 долларов.’		остало	Петр-у је оста-ло десет долар-а
36	Serbian	62	answer	X (answer) Y	отвечать	X (отвечать) Y-у	odgovoriti	NOM	DAT	Y	NOM_DAT		Petar je odgovori-o učitelj-u	PN.NOM.SG be.PRS.3SG answer-PART.PERF.M.SG teacher-DAT.SG	‘Petar answered the teacher.’	PN.NOM.SG быть.PRS.3SG ответить-PART.PERF.M.SG учитель-DAT.SG	‘Петар ответил учителю.’		одговорио	Петар је одговори-о учитељ-у
36	Serbian	63	open	X (open) Y	открывать	X (открывать) Y	otvoriti	NOM	ACC	TR	TR		Petar je otvori-o tegl-u	PN.NOM.SG be.PRS.3SG open-PART.PERF.M.SG jar-АCC	‘Petar opened a can.’	PN.NOM.SG быть.PRS.3SG открыть-PART.PERF.M.SG банка-АCC	‘Петар открыл банку.’		отворио	Петар је отвори-о тегл-у
36	Serbian	64	be_different	X (be different) from Y	отличаться	X (отличаться) от Y-а	razlikovati se	NOM	odGEN	Y	NOM_odGEN		moj-a košulj-a se razlikuje od tvoj-e	my-NOM.SG.F shirt-NOM.SG REFL differ.PRS.3SG from.near your-GEN.SG.F	‘My shirt is different from yours.’	мой-NOM.SG.F рубашка-NOM.SG REFL различать.PRS.3SG от твой-GEN.SG.F	‘Моя рубашка отличается от твоей.’	REFL	разликуjе се	мој-а кошуљ-а се разликује од твој-е
36	Serbian	65	fall_behind	X (fall behind) Y	отстать	X (отставать) от Y-а	zaostati	NOM	zaINS	Y	NOM_zaINS		Petar je zaosta-o za Marij-om	PN.NOM.SG be.PRS.3SG fall.behind-PART.PERF.M.SG behind PN-INS.SG	‘Petar fell behind Maria.’	PN.NOM.SG быть.PRS.3SG отстать-PART.PERF.M.SG за PN-INS.SG	‘Петар отстал от Марии.’		заостао	Петар је заоста-о за Мариј-ом
