language_no	language	predicate_no	predicate_label_en	argument_frame_en	predicate_label_ru	argument_frame_ru	verb	X	Y	locus	valency_pattern	comms	sentence	glosses_en	back_translation_en	glosses_ru	back_translation_ru	comms_internal	verb_original_orthography	sentence_original_orthography
36	Serbian	125	marvel	X (marvel) at Y	поражаться	X (поражаться) Y-у	biti oduševljen	NOM	INS	Y	NOM_INS	Non-verbal predicate (passive).	Petar je bi-o oduševljen t-im grad-om	PN.NOM.SG be.PRS.3SG be-PART.PERF.М.SG amaze.PART.PASS.NOM.SG this-INS.SG.M city-INS.SG	‘Petar was amazed by this town.’	PN.NOM.SG быть.PRS.3SG быть-PART.PERF.М.SG восхитить.PART.PASS.NOM.SG этот-INS.SG.M город-INS.SG	‘Петар поразился этому городу.’		одушевљен	Петар је био одушевљен т-им град-ом
36	Serbian	126	despise	X (despise) Y	презирать	X (презирать) Y-а	prezirati	NOM	ACC	TR	TR		Petar prezira Marij-u	PN.NOM.SG despise.PRS.3SG PN-ACC.SG	‘Petar despises Maria.’	PN.NOM.SG презирать.PRS.3SG PN-ACC.SG	‘Петар презирает Марию.’		презира	Петар презира Мариј-у
36	Serbian	127	get_upset	X (get upset) with Y	огорчаться	X (огорчаться) из-за Y-а	rastužiti se	NOM	zbogGEN	Y	NOM_zbogGEN		Petar se rastuži-o zbog sv-og sin-a	PN.NOM.SG REFL upset.PART.PERF.M.SG because.of one’s-GEN.SG.M son-GEN.SG	‘Petar got upset because of his son.’	PN.NOM.SG REFL расстроить.PART.PERF.M.SG из-за свой-GEN.SG.M сын-GEN.SG	‘Петар расстроился из-за своего сына.’	REFL	растужио се	Петар се растужи-о због св-ог син-а
36	Serbian	128	get_irritated	X (get irritated) with Y	раздражаться	X (раздражаться) на Y-а	biti besan	NOM	naACC	Y	NOM_naACC	Non-verbal predicate.	Petar je besan na svoj-u kćerk-u	PN.NOM.SG be.PRS.3SG angry.NOM.SG on one’s-ACC.SG.F daughter-ACC.SG	‘Petar is getting irritated with his daughter.’	PN.NOM.SG быть.PRS.3SG зол.NOM.SG на свой-ACC.SG.F дочь-ACC.SG	‘Петар раздражается на свою дочь.’	Comms: alternative is: Петар се љути на свој-у кћерк-у. [Петар.NOM REFL сердиться.PRS.3SG на свой-ACC дочь-ACC]. Петар сердится на свою дочь. See 122 and 117.	бесан	Петар је бесан на свој-у кћерк-у
36	Serbian	129	be_fond	X (be fond) of Y	симпатизировать	X (симпатизировать) Y-у	simpatisati	NOM	DAT	Y	NOM_DAT		Petar simpatiše Marij-i	PN.NOM.SG be.fond.PRS.3SG PN-DAT.SG	‘Petar is fond of Maria.’	PN.NOM.SG симпатизировать.PRS.3SG PN-DAT.SG	‘Петар симпатизирует Марии.’		симпатише	Петар симпатише Мариј-и
36	Serbian	130	be_shy	X (be shy) about Y	стесняться	X (стесняться) Y-а	stiditi se	NOM	GEN	Y	NOM_GEN		Petar se stidi svoj-e visin-e	PN.NOM.SG REFL shame.PRS.3SG one’s-GEN.SG.F height-GEN.SG	‘Petar is embarrased about his height.’	PN.NOM.SG REFL стыдить.PRS.3SG свой-GEN.SG.F рост-GEN.SG	‘Петар стесняется своего роста’	REFL	стиди се	Петар се стиди свој-е висин-е